,topic,document
2149,3,"Former Records Office: Former Records Office, 295 Queen St.  Now a campus for  Ursity now."
2150,36,364 Lt  St: The former buildings for the Women’s Venereal Disease and adjacent TB Clinic sit at 364-378 Lt  St. 
2151,36,364-378 Lt  St: The former buildings for the Women’s Venereal Disease and adjacent TB Clinic sit at 364-378 Lt  St. 
2152,3,Children's Court of : The Children’s Court of  is another notable building at 477 Lt  St 
2153,3,Former Royal Mint: The g old Royal Mint building  is now the Hellenic Museum.
2154,8, Gardens:  Gardens near  to  underground loop station.
2155,8, Gardens caretaker cottage:  Gardens caretaker cottage
2156,60, of  Bowls Club:  of  Bowls Club
2157,3,"The County Court: The County Court hs ‘The Lady of Justice’ sculpture by William Eicz , which sits above  to the building."
2158,3,Supreme Court : The historic Supreme Court at 459-505  St was built between 1874 and 1882 and still in use. 
2159,3, Court: Next to the County Court is a 3-storey building formerly known as  Court at 470  St. It was formerly advertised as a place of lodgings in the ‘The Argus’ newspaper on 19 January 1937.
2160,18,State Public Offices: At 436  is the State Public Offices.
2161,2,Emporium: Emporium shopping complex 
2162,3," court H: dates back to 1891. Has been used in a number of movies such as ""Till Human Voices Wake Us"" with Helena Bonham Carter."
2163,12,"Private rt Mactier VC Memorial Gardens: Named after rt Mactier, a winner of the  Cross who lost his life in circumstances of extraordinary bravery ng WWI"
2164,2,Tutura Hot Bread: Dates back to 1878 and hs a historic oven.
2165,12,Victory : Opened in 1925 by the then Governer General.
2166,14,Sacred Heart Parish Curch: Oped 7 august 1889. Rebuilt at a cost of 9000 pounds in a nesque style and blessed in 1912 as it had outgrown the previous building.
2167,14,Sisters of Mercy Convent: Blessed in June 1941.
2168,14,'s Church Building: build 1901 with its beuatiful balcony and cast iron work.
2169,12,Tatuta Wartime Camps Museum: Home to a ple of artefacts depicting the history of the camps in the /  area from WWII.
2170,5,Bridge: Across the Bridge (near the Chinese Garden)
2171,17,River View: River awaiting more rain
2172,27,Park: Park with toilet b.
2173,29,Skate Park: Track and Skate Park
2174,5,Track under the Bridge: Walk under bridge to playground
2175,8,Chinese Garden: Take a stroll in the Garden
2176,17,Wild Life: You might spot some wild life in and around the river
2177,22,River views: River views along the walk
2178,3,Black Rock C Tower: This 4 faced c and brick tower was built in 1959 and still keeps the time today.
2179,6,"Playground and picnic area: The playground has a nautical theme of course! There are picnic tables, BBQ's and toilets here also.
"
2180,4,Path to walled walk and beach: Take this path down to the beach.  There are several other options also.
2181,3,The bstone sea wall:  The sea wall was developed to protect Beach Road.  Sections have been built using original bstone from the Old   Gaol. The inscriptions on stones are still visible.  
2182,0,Ricketts Point Marine Sanctuary: A special place to snorkel and see schools of fish and other marine creatures.  Be amazed at what lives just below the surface!   
2183,0,"s and pelicans: There are often s and pelicans at this spot.  If they are not there, they are probably further along at Rickets Point."
2184,55,Quiet corner beach and picnic area.: The wall ends here at this peaceful beach.  Further along the beach is Rickett's Point.
2185,4,Coastal walking path: The narrow unsealed coast walking path runs llel with Beach Road wng its way through coastal heathland with elevated views out over the Bay and beaches to the .
2186,4,"Rugged beauty of the beach landscape: With the water on one side and the natural vegetation hiding the road on the other, the is nothing to disturb the peace!"
2187,4,Stairway between road and beach: Another access point to the beach.
2188,6,"Wonderful rock pools: The rocks are covered with green and red algae which shelters a range of invertebrates including brittle stars, bristle worms and crustaceans."
2189,55,Jetty : Begin with a walk out on this jetty near the  boat ramp.
2190,0,Pelicans!: Western Port is recognised as a 'wetland of internal importance' under an internal treaty called the Ramsar Convention so local and internal birds can be seen here.  
2191,39, coastline from the jetty: Looking back at the  r Yacht Club and boat ramp.
2192,38,"Fisherman and fishing boats: Try your luck at fishing while you are here, you are likely to have some company!"
2193,4,Beach: If the tide is out you can walk along the beach for sections of the walk. 
2194,15,"Seat and view: Take a seat, there are plenty along the way."
2195,39,Mans and rowboat: A local coming ashore from his boat.
2196,9,Track: The track is flat and well defined.  Pack your hat on the sunny days as it is mostly exposed.  
2197,55,Jetty near  North Boat Club: Enjoy the view from this shady picnic area.  
2198,6,Picnic area: There are many facilities here to make for a pleasant stop.  Picnic tables and BBQ's and a toilet and shelter shed.  
2199,55,Cute bridge: Another opportunity to walk along the beach. 
2200,30,Enjoying the walk: This walk can be enjoyed by you and your dog!
2201,56,Picnic area and oval: Another spot for a picnic is by the  reserve.  There are drinking water taps here.
2202,4,Lookout: Have an elevated view over the coastal vegetation and the  inlet.
2203,38,": You can see why  is a perfect spot for fishing and boating and for our feathered friends to roost, breed and feed!"
2204,10,The end: This is the end of this walk but you can keep going along this marked walk through the  Nature Reserve.
2205,2,brook &  Neighbourhood H: This organisation is made up of residents of brook and   and surrounding areas who are committed to listening to and representing local people to build a proud community.
2206,6,"Ash Reserve, also known as brook Reserve: Ash Reserve is a peaceful park tucked away inland from the bustling  Road. The inviting playground and barbe makes it a great family spot for weekends or those warm Summer evenings."
2207,3,1950s h: 't you love these reminders of 1950s  in brook? The housing age of the 40s and 50s was addressed by the Housing Commission which operated from a large new factory in glen.
2208,37,"Kinder Smith Reserve: This lovely green space sports a  new playground with state of the art equipment for  children. The area also offers a new GreenWORKS! Mural, RecWest YMCA activities and Sunshine Football Club."
2209,57, Chisholm Cic College : This popular co-educal Cic secondary school offers many examples of contemporary architectural and educal art and design for the school community to enjoy. 
2210,1,Skewes Street Laneway Mural: As you walk along Skewes Street and through the laneway to the shops you'll be pleasantly surprised by this fresh mural which showcases the creative expertise of some  artists.
2211,34,"Goodstart Early Learning Centre: At Goodstart brook, the staff strive to maintain a clean, safe and engaging environment for the children. Goodstart is  a multicultural centre with bilingual staff.
 "
2212,2,"Cao Ðài Vietnamese Temple: Cao Dai  is a new religious movement founded in Vietnam. It mixes ideas from other religions and was  officially established in the  of Tây Ninh, southern Vietnam in 1926."
2213,19," Pool: In summer months, the  pool is a fine place for the kids to play whilst adults may take in a walk"
2214,31,Lake Pier.: There are a couple of places that have piers around the lake.
2215,6,Band Rotunda and BBQ area: There are many good places for picnics and BBQs and here is a few
2216,13,View looking South: The Lake is a wonderful place with a few nice views
2217,13,A nice view: The Lake is wonderful and photogenic
2218,13,Another view: Across the Lake
2219,19,The corner: The corner at the pool
2220,20,The start of the avenue of trees: The start of the avenue of trees that are wonderful for shade in summer
2221,13,The view along the lake side: The view along the lake side
2222,15,Seating along the way: There is good seating available on the route
2223,0,"Black s: Keep an eye out for the birdlife at the lake, There are Pelicans, Black s, Ducks, Coots, Cormorants etc.."
2224,20,Avenues of Gums: The Avenues of Gums are wonderful
2225,31,Another Pier: There is another pier to walk on
2226,43,A view across to the water tower: A view across to the water tower
2227,15,A few new seats for the walk: A few new seats for the walk
2228,13,The end of the lake: The southerly end of the lake
2229,10,The path: The path from the car park is a relatively smooth walk.
2230,47,Wildflowers: In Spring there are lots of different wildflowers.
2231,15,"First seat: There are a few seats, but this one faces the wrong way away from the view! But you can say hello to other walkers on the path which is nice."
2232,5,The bridge: The bridge makes for an easy walk.
2233,1,: There are many  or rock sculptures along this stretch of the walk. 
2234,23,Rocky outcrop: A beautiful spot to look around for s.
2235,7,"More : There are heaps of  around here, maybe stop and build one. If you are with children, they love it here."
2236,11,Beautiful mosses: If you are lucky you might find some beautiful mosses among s.
2237,47,"Wildflowers: More wildflowers, when we were here in early November there were heaps!"
2238,15,"Bush seats: There are three seats that sne has cut out of old tree stumps, very creative."
2239,23,The track: The track gets a little more shelter from some taller trees here. Nice dappled  and look for the odd wallaby.
2240,23,The lookout: Anticipation as you near the lookout.
2241,23,"The Balconies: The view is amazing, you could spend the day here!"
2242,23, Street Estuary: Stop at the estuary platform to view the flora and fauna that surrounds the  River
2243,54,Harris Street Entry Point: Beginning of the Trail
2244,13,Lake Pertobe Entry Point: Enter the Rail Trail via Lake Pertobe Trail
2245,54,Rail Trail: Path is sealed for easy walking and/ or bikeriding
2246,16,Klings Hill Summit View: Looking back east to 
2247,16,The view to Klings Hill summit.: At this stage the slope is a gentle undulation.
2248,16,Views back to  Hill: Beginning the ascent to Klings Hill.
2249,16,"Looking across to the  Valley: At this elevation one has a number of s to take in, including this view to wartha and beyond."
2250,0,Birdlife: Birdlife can be viewed all along the walk
2251,39, Marina: Enjoy the Marina and perhaps even the Marina Hotel!
2252,13,Lake : The walk will take you along the shores of Lake .
2253,35,"Caravan Park Entry: Walk through Caravan Park. Please be aware this is share zone with Caravan Park, walking track and cars"
2254,22,Track : River is a little dry 
2255,5,Bridge: Entering the Bush
2256,15,Seating : Seating is spaced out along this track.
2257,31,Pier: Pier with some local Ducks awaiting the return of the water
2258,42,Exercise equipment: There are two stations along track 1
2259,5,Bridge to : 
2260,44,: Cross back over the bridge to re-join the track
2261,9,Track : Track
2262,0,Water Birds: Some of the local wildlife 
2263,13,: Seating along the lake and nice view
2264,13,"Track across the Lake: Across the Lake, nice when there has be rain"
2265,39,Boat Ramp 1: Boat Ramp 
2266,1,Wall Acng: Across the wall to other side
2267,6,Bridge home: Bridge to second boat ramp and BBQ area. Start of the walk
2268,6,BBQ Area: BBQ Area
2269,0,"White Necked Heron: With lots of wetland along the walk you have a good chance of seeing a Heron or two.  They spend lots of time standing very still, keeping a sharp eye out for frogs, insects and fish."
2270,0,"Echidna: If you're lucky you might spot an Echidna out looking for ants, termites and other small invertebrates which it captures with its long sticky tongue."
2271,10,Walk markers: There are a number of markers along the way.  This walk follows sections of two walks - the Morang Wetlands Walk and the Ridge Track.
2272,50,Sheoak tree: The mat of fallen branchlets under she prevents the development of undergrowth.  For aboriginal people it was considered a safe place to leave children as snakes are said to avoid these areas.
2273,11,"Kan Apple: There are lots of Kan Apple trees along the way, a hint of things to come further along the walk."
2274,0,Beauty on a small scale: The wetlands support beautiful succulents thriving in the sow waters along the walk.
2275,9,Park view: The walk s through a diverse range of bushland and wetlands.  Along the way you get a real sense of being out in the bush.
2276,0,Eastern  Kans: Eastern  kans are gregarious and form open-membership groups. The groups are made up of 2-3 females and their offspring with the same number of males of which one is dominant. 
2277,0,Grasses and Sedges: The wetland areas support a wide variety of native grasses and sedges.  See how many different varieties you can spot along the way.
2278,0,"Wetland view: One of several small lakes along the walk.  Each one supports a wide variety of birdlife including Black s, ducks, Purple Swamphens, Egrets, Grebes and Eurasian Coots.  "
2279,0,"Black  and s: Like other s, the Black  is largely monogamous, pairing for life - there is apparently only a 6% divorce rate!  They also share parenting responsibilities of the s."
2280,0,"Dragonfly: Dragonflies usually patrol a particular area looking for insects to eat. Mosquitoes, flies and midges are a large part of their diet. This fact alone should endear these deful creatures to us!"
2281,9,Walking in open bushland: The pathway is a mix of gravel path and some more overgrown pathways like the one in this picture.  Overall the route is quite level.
2282,0,"Eastern Great Egret: The Great Egret breeds in colonies, and often in association with cormorants, ibises and other egrets.  Their nest is a large platform of sticks, placed in a tree over the water."
2283,10,"Foot bridge: Though the pathway is mostly quite wide at one point along the route there is a very small footbridge.  If you would rather avoid it, there is an alternative route back to the carpark."
2284,27,"am North Road car park: This car park was first provided in the 1980s, but was much enlarged for the Commonwealth Games in 2006. Sometimes crowded on weekends, it has the only toilets and water on this trip"
2285,16,"Down in the valley: This section of  track is the lo on this trip. Watch for mountain bike riders, but also for wildlife in the mornings and evenings"
2286,45,Head of the incline: This landing was once the top of a 1 in 10 tramway incline. A 'powerful engine' once sat here to winch the empty skips back up. What kind of engine? We 't know!
2287,23,"The hidden quarry: A narrow defile on the right leads into the hidden quarry. This is not visible from the track, though walkers on the Rock Gardens track can look down from above"
2288,32,Tramway cutting: Tramline track does not follow the course of the old tramway at this point. The cutting on the right shows where it went. Cuttings were rare on tramways as being expensive to escavate by hand
2289,16,Crest : This  at the crest of the range is long out of use. What was it for? Walk from the north corner sly west of north across Ridge track...
2290,26,Horse drinking trough: This cement lined drinking trough provided water for thirsty horses at the top of the long climb from the quarry. Still intact despite being out of use for over eighty rs
2291,16," hills summit: The trig point marks the highest point of this range, with fine views through 360 deg, including  to the south, and the  of the north-west. The view is worth the 700 m walk"
2292,38,Les Stone Park Wetlands: A great spot to try your hand at fishing. Even better if you have  children as it offers a safe space to teach them the skills.
2293,39,te Ship: This play area is great. A safe space that lets the imagination run wild. Grab your eye patch and perch a bird on your shoulder and see what adventure you end up on
2294,25,Under road cng: Avoid cng this busy road by taking the opl path under the thoroughfare. Great low risk option for people walking with groups of children or animals. 
2295,41,"Football oval: If you are walking along this path, why not stop for a kick of football on the way. The oval is well manicured and is home to permanent AFL posts. A little friendly competition never hurt anyone..."
2296,0,"Nature at its finest: The path is edged by beautiful trees almost the whole way along. Providing much needed shade in the warmer months and an excellent display of colour in Autumn, they are also home to many types of Bird"
2297,0,Bird hs: Sne has built and installed some unique bird hs in the trees here. They're dated and initialled. I'd love to know who did this!
2298,29,Skate Park: There is a skate park here that is incrbly popular and it looks like bigger and better things are on their way! 
2299,41,"Netball courts: For anyone wanting to spend some time at a netball court, these are tucked away at  Park and there is a gate from the walking track to the park"
2300,21,"The Aboriginal Cultural Heritage Trail: For those wishing to discover more about Gippsland’s rich genous heritage, this cultural trail is an excellent place to visit.
"
2301,11,"Bush tucker: Over 27 species of native plants are included in this garden, all with important roles to play for the Gunaikurnai nation."
2302,29,A must for the keen BMX bike-rider: A busy place for the BMX enthusiasts and fun for others who just like to enjoy watching the skill involved.
2303,6,"Picnic and play: A fitness station for adults and children alike, and a sheltered BBQ area for those days when a picnic enhances a lovely walk."
2304,6,Under the willow: One of many picnic table areas along the way is this beautifully shaded area under the .
2305,21,"Bev's Wonder World of Dolls: Open Tue-Fri from 10am to 3pm or by appointment at 31-33 The Boulevard, this is an extraordinary collection of dolls from around the world. "
2306,20,"Walk among the gum trees: Remnant vegetation is home to nume animals, and the birdsong emanating from the canopy is a de to hear. "
2307,44,"Bridge cngs: Along the trail, you will find  that can take you along the other side of the Waterhole Creek and back to the start of the walk (linked to the Gippsland Heritage Trail)."
2308,0,Fertile reed bed: The healthy mix of reeds provides habitat for a multitude of aquatic species as well as being useful in the g of baskets.
2309,52,Box Hill shopping centre: This shopping centre constructed in the early 1980s has obliterated all traces of the former Box Hill station. The tramway crossed Carrington St through the centre of this roundabout
2310,32,Tramway: This footpath follows the alignment of the former tramway. All earthworks have long since vanished due to extensive re-modelling. A 1905 map shows an embankment along what is now Surrey Drive
2311,4,"Surrey Dive: In its days as a swimming hole, the Surrey Dive had a fearsome reputation, and was the scene of several drownings. Today the scene is more placid, with model boats gliding across the water"
2312,3,"Box Hill brick works: Proposals to demolish the derelict brick works have been rejected as this is one of the few -type rotating brick kilns surviving in ia. However, neglect and vandalism have taken a "
2313,1,Morning greeting: I'm not sure who this saint is but he looks like he's happy to be up early!
2314,6, Reserve: There's a small playground here.  I wish it had a bbq and seats too.
2315,8,"School veggie garden: If you peek in the cracks between the fence, you'll see the school veggie garden! I think it would be good if the school had a wire fence so you can see what's growing in the garden."
2316,41,Trugo Club: Whats Trugo?  It sounds In.  Must be a good game to play if theres a whole club set up for it!
2317,47,"Lawn Bowls Club: They play mostly on Saturday mornings I think.  I've seen lots of people here, in their best whites (probably why I'd never be able to play - all my whites are attracted to food stains)."
2318,19," Leisure Centre:  pool, spa and gym. Friendly staff, fun pool for kids and a much improved cafe."
2319,15," Reserve: A lovely park to sit in, with benches, a weird sculpture and a bright red mural on the walking path.  There's also a monument to Harry (who's Harry?),  lovely flowers and a funny shaped tree."
2320,2," Mall: A nice place to sit and listen in on the local gossip if you speak In, or Greek or Lnese?  Good spot for coffee and a great kb/falafel.  Post office is here too."
2321,0,H on the corner: Who knows what this is! There's no explanation.  I asked a bloke passing by - his theory was that it was a h for the pigeons.  Unlikely.  The mystery continues...
2322,2, Library:  library is fabulous!  You can borrow up to 30 items at a time - I usually stick to 5.  
2323,52," train station: You can book Vline tickets here.  Recent improvements with lots of new plants, sete lane for cyclists and better ing and disability access.  Good work!"
2324,25,"/ Rd intersection: An apparent slip by 1888 surveyors resulted in 's worst intersection before the rail line went underground. Major collisions on the cng took place in 1926 and 1952, each claiming 9 lives"
2325,18," Road:  Ave was previously  Rd north and south of  Rd. The 1920s post office was on the south side, the 1970s post office on the north corner"
2326,2," station square: The retail complex on the  was built in the  early 1970s,  Mall in the early 1980s. The car park was re-modeled in the early 2000s. Some retailers have e better than others"
2327,21," Road: In earlier days  Rd,  Rd has been busy for many rs, though the shops have changed much. The site of Maguire's garage, long a local landmark, is now the Commonwealth Bank"
2328,52," rail station:  station was opened in 1920. The first station was burned down in 1971, and was replaced in 1982, burned again, a third station in 1988, and today's sub-surface station is actually Mk IV"
2329,18," Ave:  Ave became a retail area in the 1960s. It was home for many rs to  fire station. The fire brigade practiced in Maguire Park, where pranksters put detergent in the "
2330,48," Progess : The progress  opened in 1926, hosting local dances for many rs, and rallies in World War II. Damaged by fire in the 1990s, the  was repaired, and still hosts community events today"
2331,18,"""Post Office Bell"" 2008: Dr Anton Hasell created the bell.  Hassells ""'Little Sister Bell"" is suspended in the centre and chimes on the hour.  Atop sits the historic 1880's  Post office bell and a  figurine."
2332,12,"Jubilee  /  Regl Art Gallery: Jubilee  was opened in June 1924, the jubilee r of the Methodist Church next door."
2333,14,Wesley Performing Arts Centre: Formerly the original  Methodist Church (opened in 1912).  Inside still today is the original pipe organ; the diapered designs on the display pipes are outstanding. 
2334,14,St Michaels and  Church: Built in 1987; the a winning design is the work of distinguished and internally wned ian architect Greg s
2335,14,St  Uniting Church 1962: Designed by architect  Reed.  Much of the original stone from the old church was used in constructing the new building.  The stone was quarried from 
2336,21," Theatre: An outstanding example of the work of Bohringer,  and Johnson, one of the most important and prolific cinema architectural firms in ia"
2337,17,"'Platanus acerifolia: Woven Nest' 2009: This environmental work by Michael Shiell was installed as part of 2009 ""Art is...Elemental"" Festival."
2338,18,Original  Letterbox: This original  Letterbox inspired the design of the Post Office Bell sculpture in Firebrace Street.  
2339,3," Town  /  Regl Art Gallery: Built in 1938/39 as a municipal complex and was designed by  architect Charles  Hollinshed, who also designed Her Majesty's Theatre in "
2340,1,"Roof Top Ribbon 1998: ng the 'Art is....Energy' Festival in 1998, New Zealand sculptor Jeff Thomson, ""the undisputed Iron Man of asia"", was commissioned to create a sculpture."
2341,12,Boer War - Avenue of Honour & 'rts' Tree 1901: The only avenue to commemorate the Anglo-Boer war was planted in  in 1901.  The remaining elm  of the original Avenue was planted to commemorate   Lord rts.
2342,1,"Totem Pole 2000: Angie Polglaze was commissioned by the 'Art Is... A River of Time' Festival in 2000, to create this piece of Chainsaw Art.  It was carved publically and noisily ng the festival."
2343,17,"""Wimmera River Burnt Creek Meeting Place"" 2007: The sculpture takes the form of a seating arrangement.  The work uses stone mosaic to depict the intersection of the Wimmera River and Burnt Creek as a meeting place of the 5 tradil owner groups."
2344,1,Painted Tiles 1997: Images on the tiles reference chnages in   life through the seasons.  The pictures are the children's vidual reflections on their culture and environment.
2345,1,Bradbury Lane Mural 2008: Local visual artist Nichola Clarke worked with youth groups from the area to create the Bradbury Lane Mural.  The instion for participants was to paint their idea of a future .
2346,37,"""Aerial"" 2009: The metal sculptural mural ""Aerial"" depicts aspects of the Wimmera's unique landscape; a ravens eye view of the area made in conjunction with students of McKenzie  Creek campus of  College."
2347,14,"St John's Anglican Church 1957: Features an expansive wooden ceiling, various stained glass windows and two significant sculptures.  'Wayside Cry' and 'Compasste Christ'"
2348,16,"That view!: When you reach the top of , make sure you spin around and take in the view. Look over the new estate and see the beautiful hills in the background."
2349,38,"Fishing Lagoon: This beautiful lagoon, surrounded by reeds is the perfect place to stop and try your hand at fishing. Shaded by beautiful trees, the picnic area is also a good place to stop for lunch."
