,topic,document
0,4, Surf Life Saving Club:  is a well known surf beach. The beach is patrolled ng December to the Easter. The  SLSC was established in 1958.
1,4,"Beach walk: From Sprout Creek, , ,  to the bottom of the  h there is approx 6 km of beach, featuring rolling surf and spectacular views of the Otway Ranges and e."
2,0,"Rock pools: See what sort of shells and stones you can collect. Can you find a bright red sea star? You can see all sorts of sea vegetation, small fish and crabs. Look at the bird life, gulls and cormorants."
3,4,Sand dunes: The beautiful rolling sand dunes shape the beach. 2011 has seen significant erosion due to winter storms that have bought strong winds and big waves (up to 10 feet).
4,26,Painkalac Creek: The creek setes  from  and forms an inlet behind the sand dunes before it cuts through to the ocean. A great place to shelter from the wind and for er children to swim.
5,9,Rocks and caves under the  h: There are more rockpools and rocky outcrops to explore under the  h. This area is part of the marine nal park. This means that all wildlife is protected and cannot be removed.
6,29, playground and picnic ground: There is small skateboard ramp for children to ride their scooters or skateboards. There are also swings and other play equipment for children and a picnic area.
7,48," lower shops: Pick up a coffee, newspaper or Fish and Chips! To the left of the shops, on the other side of the river, kans can be seen in the early morning or at dusk."
8,4,Loutit Bay lookout: Return to Painkalac Creek inlet and walk to the grassed area on the left. At the  h bollard turn right and walk up the signed (steep) walking track. Enjoy panaromic views on your walk up.
9,3,Historical  and building: At the h is the original  for the h keeper. The  area was first settled in the 1840s. The first tourists arrived in 1919.
10,44,Split Point h: Follow the signs and continue up the walking track. Shipping along the n coast was much safer once the combination of this and other hs at  and  were built.
11,52,"1. Tramway signal box: Built in 1928 soon after the electrification of the ston St and St Kilda Rd cable tramways. Originally included female public toilets, roofed passenger waiting area, small store and staff toilets."
12,27,"2.  Baths: Built in 1903, the design reflected the social conventions of the time. Men and women were segregated for all facilities; second class baths were in the basement, first class on the main floor. "
13,3,"3. Magistrates Court: Built on the site of the earlier Supreme Court, the building retains fittings from the earlier court including the Gothic canopy that judge Sir  Barry sat under ng Ned  trial in 1880."
14,3,"4. Old  Gaol: Built between 1851 - 1864. As the oldest surviving penal establishment, it was the site where Ned  was imprisoned, executed and buried, amongst many other criminals."
15,12,"5. Eight Hour Day Monument: Built in 1923, the monument commemorates the Eight Hour Day movement started by stonemasons in 1856 to improve working cions - eight hours labour, eight hours rest and eight hours recreation."
16,21,"6. Trades : Built in stages from 1873 - 1926, Trades  is of historical and social significance as a centre of radical and working class politics and activism in  for over 100 rs."
17,3,"7. Medley : Built in 1893 as a private residence, the building has since hd the In Club, In Consulate and for  time was used for a 'less reputable purpose'. "
18,3,8. Lygon shop corner: Lygon Buildings is architecturally significant as the largest and most intact terrace of nineteenth century shops in . There are no other comble retail structures in .
19,3,"9. Matthais H: A two storeyed stucco faced bstone h of 1865-6 with many charming and unusual features - a tower and weathervane, a cantilevered cast iron balcony and delicately glazed arched windows."
20,14,"10. Sacred Heart Cic Church: Built in 1855-56. In the 1930s and 1940s the Church of the Sacred Heart became a primary focus for Carlton's In community, and this continued into the 1960s."
21,3,"11. IMAX Theatre: IMAX is the world's largest cinema format, with a screen up to eight storeys high. Films, from documentaries to latest release movies, can be experienced in 2D or 3D."
22,21,"12.  Museum: The museum has eight galleries, including one just for children. Highs include a complete skel of a b w, the aka Aboriginal Cultural Centre, a living rain and Phar Lap."
23,3,13. Royal Exhibition Building: The Royal Exhibition Building is the only surviving Great  that once hd a 19th-century internal exhibition and is still used for exhibitions. 
24,8,"14. Carlton Gardens: Developed in 19th-century Gardenesque style, the Gardens feature symmetrically-placed garden beds, significant avenues, the path system, specimen and clusters of trees, 2 small lakes and 3 s."
25,7,"15. Playground: Wonderful playground with swings, slides and many opportunities to climb and cl, plus small hills to roll down!"
26,34,16. Carlton Gardens Primary School: The school is an In Gothic style building built in 1884 with a hipped roof central pavilion buttressed either end by sly projecting .
27,3,"17. Terrace Hs (201 - 205  Street): Built in 1884, Holcombe Terrace is a fine example of boom style terrace architecture and notable among the works of Norman Hitchcock."
28,12,"18. Museo Ino: Museo Ino displays and interprets the experience of In migration, and the culture created by Ins in ia."
29,3,"19. La Mama Theatre: Built in 1883, the building was used for various industrial purposes. In 1967, it was leased by Betty Burstall, teacher and theatre-lover, for use as a small theatre to nurture new ian drama."
30,27,"19. Underground public toilets: The underground public toilets, built in 1939, are one of eleven built in  in response to public demand for public toilet facilities in  that were both sanitary and discreet."
31,3,"21. 313-315  Street: Built in 1889, the buliding is architecturally significant for its highly unusual grotesque Gothic facade. The kan-gryphon grotesques on the pet are highly unusual and distinctive."
32,3,22. Carlton Court H: The Carlton Court H is historically significant as part of the civic core of  Street. It is directly opposite the 1878 Carlton Police Station. 
33,52,The  Wharf:  Wharf has been a vital part of the town and inland river transport system since the 1880s. It was established by the  Progress Committee in 1888 to assist the burgeoning river trade.
34,5,Railway overpass: A  walk across the railway overpass leads to  Ave or head left down to the  King Drive underpass to avoid the stairs.
35,5,Prince and Princess of Wales  Plaza: This  is very special as it was opened by the Prince and Princess of Wales on the 29th October 1985. Many  residence crowded around to see the Princess Diana.
36,12,"War Memorial : To the left is a War Memorial commemorating those who served in Vietnam, Korea
and South East Asia."
37,1,"Sculpture commemorating Alfred , Primie Minister of ia and the initiator of the : Sculpted by Michael Meszaros and presented to the  to mark the centenary of the irrigation colony in 1987. The memorial represents  fruit bs and irrigation channels as seen from the air. "
38,40,"The G Hotel (to the right): Enter the G Hotel’s main entrance and turn left. To your right, you will see a display of historical photos. Through the glass doors are one of ’s original  s."
39,3,"Commodore Motel former site of the  bo h: Back in 1888, this site was a early bo h called the . A plaque marking the site can be found at  to the motel’s restaurant. The  was demolished in 1965.
"
40,21,"WIN TV: Originally STV8, opening in 1966 and next door is the Sunraysia Daily, the local newspaper.
"
41,18,"The Cultivator: ’s earliest newspaper was the Cultivator, begun in 1888. It was a
twice-weekly publication that moved to the current Sunraysia Daily site at
22  Avenue in 1912."
42,18,"Sunraysia Daily: Local identity, C.J De Garis bought The Cultivator along with the 
Telegraph and  Irrigationist and merged them into one paper, the
Sunraysia Daily, in 1920."
43,5,"George and William  Building: Across the road is a single story late n, red brick building, with
a brick and iron palisade fence. The building was gifted to La T Uni in 2009 by  Carrazza."
44,43,"Electric Supply Department Substation No.1: In the centre plantation, stands the Electric Supply Department Substation No.1, dating back to 1936, when the production of electri was considered a local responsibility, rather than a state one."
45,12,"Queen  II visit to ,  25th, 1954: When Queen  toured  in 1954, a decorative dais was erected in this area of the plantation.  Pics of this day are displayed at the  Centre. Visit to Barclays B in "
46,3,"Bowring's Store, corner  Avenue and 8th Street - Circa 1937: The site of the ANZ Bank was previously known as Bowring Corner and was the site of Bowring’s Store, opened in 1888. It extended into Langtree Avenue in 1961 but ceased business two decades later.
"
47,18,"Old  Post Office (LHS of  Ave): This corner building was for over a century, the  Post Office. The earliest Post Office on this site was built in 1890, with much of the current building being erected in 1923. "
48,12,"George V Memorial  (in centre plantation): Cng into the centre plantation, you will find the George V Memorial , originally erected in the gardens of the Rio , home of W.B , it was moved to its current position in 1936"
49,3," Law Courts (LHS of  Ave): Opened by rt Hulls, ’s Attorney General, on Nov 23 2004. This complex was built on the site that n as Washington Stores, before becoming Maples, before it all went up in flames in 1996"
50,18,"70  Avenue (LHS of  Ave): Once the site of the Shire Offices, beginning as a modest, timber, two roomed building before the current building was erected in 1922. In 1971, the Shire Offices were relocated to Irymple. "
51,18," Centre - Home to the Historical and Genealogical Societies (LHS of  Ave): Constructed in 1908, as the  Library, courtesy of a 2000 pound  made by Andrew , in 1906, after a request from Lord Hopetoun. The tower was added in 1922 as a soldier memorial."
52,18,"Civic Buildings  (LHS of  Ave): The Civic Buildings, opened in 1958 and it’s also the site of the original Shire , also known as the  Town ."
53,1,"Statue of W.B.  (in center  plantation): In the center  plantation is a statue of W.B. , who died in 1926. The Paul Mountford sculpture was unveiled in 1929. A sir sculpture can be found in , SA. "
54,12," Rotunda (in center  plantation): The centre  plantation is home to the  Rotunda, named for Cr George , former Shire President, who died whilst in office in 1913."
55,18,"61  Ave - 's earliest surviving building (RHS of  Ave): On the RHS of  Ave is the earliest surviving building in . It started out as ’s first general store, owned by H.B , in 1887. A bank altered the building appearance in 1937."
56,18,"69  Ave (RHS of  Ave): Built in 1914, this  Edian building has been a restaurant, a bank, a real estate agency and other businesses, which although altered over the rs, still retains some of its original charm.
"
57,18," Club (RHS of  Ave): The  ""Gentlemen's Club"" n in 1890 with Lord Ranfurly as the first President. Meetings were originally held at the Coffee Palace, until this building was completed in 1920. "
58,3," Cinema Complex  (RHS of  Ave): The  Cinema complex was  established in 1975. A point of interest is that the cinema includes the original site of the Masonic Temple, built in 1907, with the façade still remaining. "
59,18," Workingmans Club (LHS of  Ave): An iconic landmark, once famous for having the world’s longest bar (which was removed in recent vations.). Begun in 1908, it was originally a 1 story structure with a 2nd level added in 1935. "
60,12," Workingmans Club  War Memorial (LHS of  Ave): Has stood at the front of the club, since 1920, honoring ’s war dead. The marble soldier is the work of A.D Thomson and the three-sided list of soldiers’ names underpins the heavy losses of WW1"
61,14,"Methodist Church (LHS of  Ave): Opened in 1912, this unique church had a number of architectural infnces, including Byzantine, Queen Anne, Masonic and Art Nouveau . Image: Methodist Church under construction 1911."
62,14,"The Church of Christ  (RHS of  Ave): Built in 1908, the Church of Christ was first organised by Reuben Mansell in 1890 and members met in a variety of venues until this building was completed using all voluntary labour. "
63,12,War Memorial (centre plantation): Commemorates those who died or were killed in World War One. Erected by the  Branch R. S. & S. I. L. A.
64,14,"Uniting Church / St Andrew’s  (RHS of  Ave): The Uniting Church, known as St Andrew’s, started out as a Presbyterian church and was built in 1914, at a cost of 2097 pounds. It replaced a wooden structure that had been there since 1891. "
65,14,"St Margaret’s Anglican Church (LSH of  Ave): This church opened in 1902, with the addition of the sanctuary in 1934 and the vestry and bell tower in 1957 that honours the lost soldiers of World War II."
66,3,"Madden Avenue : Madden Ave was originally planned to be the principal retail district of  due to easy access to the wharf. However,  Langtree, with it’s proximity to the railway proved to be more significant"
67,21," RSL Sub Branch: The Returned and Services League with some 1500 Sub Branches ia wide and with a membership of 240,000 is the largest service association in ia."
68,43," Water Tower: As you cross over 10th street, to your right you will see one of  's Water Towers. Built in 1957, the tower provides water pressure for thousands of homes across the urban area."
69,40,"Mecure Hotel : Commercial Hotel, commonly remembered as the Wintersun and now the Mecure Hotel was built in 1925"
70,43,"Disused water tower: Behind the hotel is a disused water tower, which from 1912 until 1957 operated as ’s sole source of water storage. Instigated by the former First  Irrigation Trust. 180000 litre capa"
71,48,Under the Cs: 's well known and iconic meeting place is under the cs at  Street Station. Sit on the steps and see the world go by. 
72,1,"Mirka Mora mosaic: Mirka Mora made this mosaic in about 1985, it is brilliant. Do not be one of the thousands who walk past it every day without stopping. "
73,10,"To  Marr: The slope down to  Marr, always fills with expectation. The sculpture of hundreds of red poles is a cracker. Go up and push the poles firmly, what a noise!"
74,48," Square: There always seems to be something happening at Fed Square whether it is concerts, buskers, festivals or people lolling about. The pavers are great to sit on on a sunny afternoon. "
75,21,The Art Centre from Fed Square: Looking over to the Art Centre spire from Fed Square.
76,7," Marr playground: The playground is always open. Watch kids play and enjoy the tube slides, sand pits, swinging hammocks, activity panels, rock and rope climbing features and balance beams."
77,37,Art Play: Art Play is a great place for children it has lots of shows and creative activities for kids.
78,1,"Mosaic outside art play: I do not know what the story is behind this  coloured mosaic outside Art Play, but it is wonderful. "
79,56,"Textured path: The wng, textured pathway of cast iron acknowledges the significance of the eel as a tradil food source for groups camped by the river."
80,15,Watching rowers from  Marr: Sit on the seats under a shady tree watching rowers go by.
81,5,To Princes Bridge: The gravel path on the river bank is a bit quieter. More seats and looking back to Princess Bridge. 
82,17,West along the river: From 'Angel' you can get a good look along the  River 
83,1,"Angel: Angel (ceramic, steel and concrete) by Dah Halpern is an artwork commissioned by the Nal Gallery of . It is even more impressive than the photo suggests. "
84,7, hill for rolling: There should be more  hills like this one in the centre of cities. Watch the number of kids who are immately drawn to it and roll down laughing.
85,5,Walking up the slope to the bridge: The trees and shrubs set in the stone fence as you walk up the slope to the William k bridge. 
86,5,"William k bridge: A purpose built walking (and cycling) space, William k bridge is one of true des of . Beautiful and funcl.   "
87,27,"Listening to Proximities: Proximities is a public art installation commissioned for the 2006 Commonwealth Games.  The stories and songs from 53 Commonwealth nations come out of the many, many srs across the bridge. "
88,41,Sit and watch : Sit on the bridge and look south to the  and Tennis Centre or north to the  and listen to the trains go by under.
89,39,Off the bridge to the 'G': Coming off the bridge and walk to the MCG under the shade of magnificent old Elm trees.
90,29,"The MCG: The MCG, what a collosseum. You 't realise how massive it is until you actually see it. Even if you 't like sport, the sound of the crowd cheering will grab your attention."
91,1,"Dennis Lillee: Bronze statues do around the MCG, none more impressive than the great Dennis Lillee."
92,41,Aussie Rules: Statue commemorating the first game of ian Rules Football said to be played nearby on 7 August 1858.
93,52, Station: Its a beautiful the old train bridge. Catch a train (or tram) back to  St or keep going. 
94,12,"Watt's Cottage: Home to early settlers in Sorrento, this h was built in 1869. The Pioneer Memorial Garden is well tended with blooms all r round. Tours available (at limited times)."
95,2,"Information boards and cafe: Check out the information boards here for details about the history, local environment and features of the area. All S Cafe located a  walk away from here."
96,4,"Surf's up: A good spot to watch the surf, have a picnic, go for a swim, read a book or do whatever you please."
97,9,Uphill climb tos the top: Definitely a steep climb uphill but the scenery from the top is very worthwhile. Get your heart rate up!
98,23,"Panoramic views: A perfect spot to watch the , or simply enjoy the sweeping panoramic views."
99,4,"Heading down to the beach: Follow the track, which will eventually take you tos the beach."
100,4,Fine : Enjoy the salty sea breezes as you feel the sand under your feet on this beautiful stretch of coastline. 
101,27, Surf Lifesaving Club: You can take a detour here if you need a toilet stop.
102,4,'Lon Bridge': A great spot to explore pools and wander under the 'Lon Bridge' (but not ng high tide of course). You can continue along the beach all the way to Point Nepean if you like.
103,27,Public toilets and drinking : Phew! It's a pretty steep ramp that leads you up here. A convenient toilet stop and a chance to top up your water bottle before heading off again. 
104,9,Start of 's Folly Track: There's a sign a near the car park marking the start of the track. Apparently Capt R  simply lit a match wherever he thought the bush needed to be cleared for the army\'s weapons training areas.
105,0,Looking out to the sea: Listen out for the twitter of small birds in this fabulous bit of coastal bushland overlooking the sea.
106,32,"Unexploded bombs: A former weapons training area. ""All large unexploded ordinance has been removed but you may come across small arms such as rifle and pistol shells,"" which of course, you shouldn't touch."
107,27,Point Nepean Visitor Centre: The visitor centre has plenty of local information and maps of the area. You can take a tour to the historical Fort Nepean (a buggy can transport you there). Public toilets and BBQ available here.
108,4,Mighty high fences: You can take a  detour down to the beach via Cove Ave. Clearly residents here like their pri but it's such a shame that the street is marred by these enormously high walls and fences.
109,11,"Nature strip plantings: Thankfully, there are patches of wonderful plants to enjoy as you walk down the street."
110,1,A little bit arty: ... and even a bit of art to give some of these high walls a little bit of character.
111,44,On the other side: Across the road are a row of charming cottages that reminds us of how the area used to look before the high walls and fences came along.
112,35,"Bus stop: You can catch bus number 788 back to Sorrento, or all the way back to  along point Nepean Road. "
113,24,Boardwalk near fishing platforms: The boardwalks starts along the path just past the carpark on  Drive. A few fishing platforms go off the boardwalk.
114,0,"Wetlands: The inlet is on one side of the boardwalk and wetlands on the other, both have an abundance of birdlife and aquatic life."
115,10,The shared path: The shared path is very popular with walkers and bike riders alike and is in pretty good cion.
116,0,Pelicans and piers: There are many little jetties dotted along the path and it is hard not to spot a pelican or two perched on many of them.
117,24,Raised boardwalks: The wonderful raised boardwalk provides a shady spot to look out to the inlet.
118,4," harbour: Old and new, big and small boats (but nothing too flash!) in the  harbour."
119,26,Coull's Inlet: Coull's Inlet is beautiful on a still early morning.
120,38,"Fishing spot: One of the many fishing spots along the walk. Even if you are not into fishing, it's fun to watch early morning anglers. "
121,23,"Goat & other nds: Beautiful views abound on the walk. , Rabbit nd and more..."
122,38,"d boats: Over the summer, many camping ground visitors more theri boats along the shore. Boats for fishing, water skiing, bird watching or pleasure.... "
123,35," Foreshore Holiday Park: The next part of the walk goes through the council caravan park, in summer there is always something to look at."
124,4,"To Capt. Sson's Point: If you want, you can take a  detour off the path and follow the water to Capt. Sson's Point (or stay on the path up above). "
125,4,Capt. Sson's Point: A great spot to look up the inlet or to the mouth (and watch boats go out to sea). You can even see Gabo nd from here.
126,0,"Koalas: If you look carefully you can often see Koalas in the trees, even the odd kan."
127,4,Cng the inlet: To get across to the beach you have to wade across about 20 meteres of the inlet which is about 45 cm p. In summer teh water is quite warm so it is very pleasant.
128,4,"Dirftwood structure: This structure that some have built in the sand dune out of driftwood has been there for a while, hope it lasts a while longer!"
129,4," beach: On a clear day the beach is beautiful other times it can be rugged and wild, but no less wonderful. This part is only for strong competent swimmers. But watch the surfers!"
130,4,"A walking beach: The beach is certainly great for walking, but can get a bit blowy."
131,4,Patrolled beach: This is the main swimming beach that is patrolled by life savers in the holiday season. Any one for cricket?
132,4,Bastion Point: Rockpools to look at and a good spot for snorkling off teh rocks when the cions are good.
133,28,Native flowers.: You'll come to a fork in the path. Walk this route as a loop or simply walk along the river till the end and return. Either way there is much to see. We found these feather like flowers. How lovely!
134,0,Beautiful views of the river: There are lots of birds enjoying the river. We saw several different types of birds swimming in the river.
135,0,Duck sanctuary: We saw a mother duck and her  ducklings nestled in a log along the river. A r nest away from predators and people. She's hard to spot in the photo because we didn't want to get too close!
136,0,Stray fruit bat: We spotted a stray fruit bat in one of the trees. It had clearly fallen behind from the group and was trying to remain hidden from prying eyes. We photographed it from afar so we wouldn't disturb it.
137,17,Still reflections: A lovely view from along the river.
138,0,"Ducks and more birds: Many birds of all sorts can be found near the boat h because they're used to people feng them, even though feng birds is harmful (see link)."
139,6,"Barbeque areas: The bbq, tables and seats are under sheltered areas. There is plenty of idyllic picnic spots in shady areas close the river. Great spot for a picnic or gathering."
140,54,Signs: So many options! Take your pick.
141,10,"Popular route: We passed several walkers, including children, a couple with a baby (must be a  4 wheeler pram!) and others using the route for exercise."
142,29,Skate Park : Large skate park ideal for families.
143,55,Jetty : A jetty to admire the scenic surrounds or do a spot of fishing. 
144,6,BBQ facilities : Large undercover BBQ facilities.   
145,2,Cafe by the lake : A cafe overlooking the lake. 
146,5,Bridge: Walk across the bridge and take in the beautiful surroundings.
147,39,Canoe Club: Canoe hire available from Visitor Information Centre.Canoes can accomodate 2 adults. Kayaks also available.
148,19,"Aquamoves: Aquamoves is an aquatic and leisure centre with facilities such as gym, creche sauna, indoor and outdoor pools. "
149,7,All Abilities Playground: A playground suitable for children and families of all abilities.
150,19,"Aquamoves: Aquamoves is an aquatic and leisure centre with gym and areboic facilities, creche, indoor and outdoor pools. "
151,7,Playground: There is a playground for the children to play on. So the whole family can come to the lake and enjoy the scenery.
152,42,Fitness Station: Fitness equipment to help you in your work out.
153,30,dogs off leash area: Area where you can let your dog off the lead. It also has a creek.
154,0,Bird Watching: You can spy on many different varieties of birds in the wetlands.
155,38,Fishing: One of the many good places to fish at the lake.
156,39,Boat Ramp: A place to put your small boat.
157,4,The beach: One of the beaches to relax on or walk along.
158,3,"Cashins Mill: Built in the early 1850s by  Kneen of Fitzroy. After James Cashin Snr died in 1873, the mill was operated by sons James and William."
159,2,"Farmers Market: First Sunday of the month - 8am to 1pm.  Park (next to Lilly Lake), sea Road, Lily."
