,topic,document
1143,8,"Botanic Gardens: The gardens were vated in 2002, with a new section for arid-cte and local native plants opened. It features a dramatic entrance combining architectural plants with modern garden sculptures."
1144,8,"Friends of the Garden: Free guided walk in the gardens are offered by the Friends of  Botanic Gardens on Wednesdays and most Sundays at 2pm, weather permitting.   For more information visit http://friendsgbg.org.au/."
1145,8,The Gardens: In 1851 the Government had the foresight to set land aside at the edge of the  settlement for the development of a Botanic Garden.  The grounds can now be enjoyed throughout the r.
1146,20,"Flora of the gardens: The gardens are full of fascinating plants with unusual shapes, textures and colours. 
"
1147,8,"The Tea Room: There is a lovely tea h in the Botanic Gardens which is open from 11am to 4pm.
"
1148,7,"Tim  Arboretum playground: The upgraded Children’s Garden includes new walking paths, adventure garden rooms including a butterfly garden and all abilities playground. "
1149,12, Memorial and Honour Roll: The names of 120 members of the ian military services from  who lost their lives while serving their country are honoured at the  Memorial and Honour Roll in the Tim  Arboretum.
1150,7,Tim  Arboretum: Walk along the duck pond to the children’s playground
1151,35,Car park: Parking is available off Francis Cres outside the Tim  Arboretum. Bike racks available. 
1152,44,Blind Creek Trail shared path: Enter off  Road and follow the trail along to  Road.
1153,7,Blind Creek Trail playground: Enjoy time with family at one of over 200 playgrounds in 
1154,44,Blind Creek Trail shared path: Continue on the Blind Creek Trail.
1155,3,U3A  (Formerly Ursity Of The Third Age): Specifically for those over 45 rs of age and retired from full-time employment. The provision of low cost educal and recreal activities in a non-competitive environment.
1156,30,"Friends of  – Blind Creek  Group: This group assists with the implementation of the Blind Creek  Management Plan. The Blind Creek  Group meet regularly & conduct weng, rubbish removal and genous planting. "
1157,56,Table & Chairs: this is on the other side of the Tourist Information Centre
1158,8,Garden : Garden
1159,56,Tourist Information Centre: Collect your historical guide for the town and information reg the region.
1160,24,Start of Walk: You can go either way around the Tourist Information Centre for the Heritage Walk
1161,6,BBQ Area: Why not stop and  a BBQ or have a picnic
1162,7,Playground: Let the kids have play for a while
1163,29,Tractor: Things to See on the Walk
1164,1,Artwork: along the track
1165,15,Rest Spots: Not take a seat and enjoy a relax in shade of the trees
1166,1,Art work: Path details - see what different ones you can spot
1167,8,Out the front: Garden 
1168,27,Toilets: Toilet b
1169,2,Hisotrical Site: General Store 
1170,3,Historical Site:  Hotel - Lovely bstone building
1171,58,"Historical Sites: Long this road there are number historical sites: Original  site, Park's  Shop, Memorial Tree, and Tom Leach's Saddlery Shop"
1172,3,Historical Site: Nal Bank Site
1173,44,Getting familiar with the Rail Trail: A map at both the start and end of this trail is a great way to get an overview of the journey you’re taking.
1174,8,"Botanic Gardens: This beautiful reserve off  Drive provides shade, the rotunda, picnic facilities along with a skate park, and is a well-loved site for locals and visitors alike."
1175,45,"Signage as art and art as signage: Created by school children who live in the area, the unique signs are dotted along the trail and cate side trips you can make. "
1176,45,"Emergency markers provide safety: Designed to pinpoint your exact location in the case of an emergency, you can be sure that in this unlikely event, you’ll find markers installed along the entire trail. "
1177,10,"Say hi to the horses: It’s not uncommon to come across others, some on horsck whilst others are walking or bike-riding, and to stop for a chat."
1178,16,View from the Old  Bridge: This is a lovely spot to stop at and look across the  Valley to the Great Dividing Range as well as down upon the rail trail and wave to others g the trip.
1179,24,"Take a trip along the boardwalk: There’s nothing quite like quietly walking along a boardwalk over a busy waterway, and depending on the time of day, you can be treated to a full orchestra of bird and frog song."
1180,55,"Lake Narraccan Jetty: The detour at Sullivans Road to Lake Narraccan is well worthwhile, especially for a picnic or BBQ lunch, a throw of the fishing line, some sightseeing and even a swim. "
1181,4,"Glimpses of 's Bay: Looking north through the trees near the eastern end of the trail, this beautiful stretch of water is a popular venue for water sports and the site of more than one nal water-skiing championship."
1182,43,"The  Cooling Towers: A breathtaking view of the working example of a coal station, where these huge towers both cool and recycle the water in the process of generating electri."
1183,8,Entrance to  Botanic Gardens: Entrance to  Botanic Gardens
1184,8,21st Century Garden: 21st Century Garden
1185,8,Entrance to Heritage Garden: Entrance to Heritage Garden and bollards of original curator
1186,22,Traill  and urn: Traill  and urn
1187,1,Storks sculpture: Storks sculpture brought from Japan in 1880s
1188,3,’s tiny first Customs H from 1838 : ’s tiny first Customs H from 1838 
1189,3, h:  h
1190,8,View of gardens: View of gardens
1191,8,Chinese lantern: Chinese lantern
1192,8,John Radden Fern Garden: John Radden Fern Garden
1193,37,Open lawn space: Open lawn space
1194,0,Friendly blackbird: Friendly blackbird
1195,28,Pretty floral display: Pretty floral display
1196,58,  pine:   pine
1197,19,Pool in 21st Century Garden: Pool in 21st Century Garden
1198,8,Cacti in 21st Century garden: Cacti in 21st Century garden
1199,1,The Welcome Mural: Gunaikurnai artist Ron Eds provides an excellent overview of the cultural trail and murals.
1200,1,Introduction to the cultural trail: This mural is well worth reading as it provides the context for the cultural trail.
1201,11,"The bush tucker garden: Over 27 species of native plants are included in this garden, all with important roles to play in the wellbeing of the Gunaikurnai people."
1202,0,"The Creation story: This mural tells the Dreamtime story of Borun the pelican man and Tuk, his  duck wife."
1203,53,Basket weaving: Local plants within the Waterhole Creek catchment can be used to weave useful (& exquisite) baskets that the Gunaikurnai nation is famous for.
1204,1,Meeting places: The gathering of the five clans and meetings with other nations is clearly depicted in this beautiful mural. 
1205,10,The five clans and their shields: Each of the five clans of the Gunaikurina nation has its own particular shield identifying the clan to which tribal members belong.
1206,1,"Snake mural: Framed by well-established trees, this mural is a wonderful depiction of an important story that details this dreamtime story."
1207,1,"A snake in the rain story: As with all the other murals, you will learn about the story that informs Ed’s painting of the snake."
1208,25," Road Cng:  Road is a main thoughfare for cars, trucks, and buses that can be quite busy at all times of the day. 
It is the only road cng ng the walk, so please take care when cng here."
1209,59,Foothills Park: This photo shows the type of landscape you will be treated to on this beautiful walk
1210,10,"Foothills Park's Gates: There are two of these gates on the walk that could prove tricky if you have a stroller, wheelchair, or walking aid. They can be a little tight to get through."
1211,6,"Foothills Playground: This is a great spot of a picnic or a rest spot. A playground for the kids, electric barbeques for a hot lunch, and tables with shade.  "
1212,7,Foothills Playground: A different view of the playground area
1213,35,"Foothills Park Hill: This is the steepest part of the walk, which is also a access road for park management."
1214,16, Views: This is just one aspect of the 360 degree views you will get from this point on the walk.  Spend some time here to pick the the surrounding features.
1215,9,"Word of Caution: Throughout the walk there mounded  humps that could catch you unaware. Also the gravel path can be loose, so take care with foot placement."
1216,10,Halfway Point: This point is where the Foothills Circuit joins the other two walks in the s reserve.  Take a right hairpin turn to continue along the Foothills Circuit.
1217,10,The back section: You get to enjoy the flatest part of the walk here. This section also adjoins and has good access to the residential areas.
1218,0," Creek Wetlands: On your return to the Council offices and your starting point, you get the opportunity to sample some of the  Creek Wetlands which continues under and on the other side of  Boulevard"
1219,58,'Scar Tree' 2003: Artist Tim Jones was commissioned to create this Scar Tree sculpture that commemorates a scarred box tree that once stood near this site. The tree was found to be 'damaged' between 1644 and 1784
1220,1,'The Urban  - Fire Memorial' 2010: Created by al Molloy-Drum this memorial responds to the 2009 Remlaw Fire. The image of the birs is the actual shape formed by the Remlaw Fire (2218 hectares of land was burnt)
1221,19,"Old Weir and Swimming Area early 1900s: ""The  Times in January 1882 commented on the need for a public bathing place, especially since many lacked a bath in their hs. By 1908 a swimming pool had been constructed in river upstream"
1222,17,"'Wimmera - Woven Vessels' 2012: Created specifically for its site along the  of the Wimmera River, the boat forms uses reclaimed fencing wire from farms including those affected by the 2011 floods. Photo by Michael Shiell."
1223,12,War Memorial: This was dcated on 18 April 2004.  It was built to replace a Cenotaph and nume memorials that were scattered around  
1224,17,Wimmera River Environment Display - Mural 1999: This piece of work by local secondary school students explores the theme of Wimmera wetlands above and below the water.  The colors and im are a direct response to the Wimmera's environment
1225,1,"Untitled Sculpture 2006: Winner of the 2006  Spring Garden Festival Acquisitive Sculpture Prize.  Sculpturally the work is an allegory of the intimate relationship between water, trees and sustainable land use"
1226,1,'' 2010: Artist Kevin Gilders was commissioned to carve two sculptures out of an old sugar gum which had to be removed from the gardens for safety reasons.
1227,8,"'Thomas Brown' 2010: The sculpture depicts founding Botanical Gardens Curator, Mr Thiomas Brown, planting the exact sugar gum on the birth of his son (circa 1895)"
1228,8," Botanic Gardens: The original design of  Botanic Gardens was undertaken by the curator of the Royal Botanic Gardens in , Mr William Guilfoyle, between 1873 and 1880."
1229,6,"Playground: The park includes a significant interactive play space, toilet facilities and electric BBQ's.

The historic Maffra Sugar Beet Museum is located nearby."
1230,22, RIver: The walk will take you along the  River.
1231,10,Excellent pathways: The walk is suitable for ps and wheelchairs.
1232,6," Lake: Start walk from the main car park, passing under an old ptype bridge span which acts as a noticeboard, walk to the right of the BBQ and shelter, up the gravel path tos Todd Road."
1233,6,"BBQ shelter: Freshwater lake from the BBQ shelter.
The toilets are to your left.
Head up the gravel path tos Todd Road passing thru the Red gum woodlands"
1234,20,Red gum woodlands: Follow the path llel to Todd Road to the end
1235,26,Steps to Heat: At the corner there are steps to down to the sandy Heath land plantings.
1236,11,Heath walk: Mixed plantings with an abundance of colour
1237,5,"Friends of Westgate Park compound: The nursery of ""Friends of Westgate Park""
Continue following road to the end of the chain link fence."
1238,44,"Sandy Heathland: Turn left onto the walking track with the small pond on your left.
Sit and enjoy the birdlife."
1239,13,Freshwater Lake: At the end of the small walking track veer left on the gravel road tos the fresh water lake. Before the lake there is a set of stairs leading to a walking track. Take the stairs.
1240,6,"Back to Road: At the end of the walking track after views of  lake you will join back with the road, continue walking right around the lake to again be at the BBQ shelter."
1241,13,Freshwater Lake: From industrial wast storage to a major water catchment.
1242,30,Friends: 't forget to look up and down.
1243,40,"YWCA's Jasper Hotel - 489  Street: The YWCA provided services to women such as housing, job placement and mentoring. Inside is a plaque acknowledging  Henry, pioneer journalist and unionist. Now a hotel and conference venue."
1244,2,"Queen  Market: The Queen  Market, established in 1878 is the largest market in ia and one of the largest in the world. Many of the buildings are still used in trade today."
1245,36,WCTU : The  was erected in 1901 by the Women's Christian rance Union who agitated for the provision of clean drinking water in public places as part of its rance concerns.
1246,18,"The Argus - corner LaT and  Street: The building hd the Argus newspaper for 30 rs. The Argus was one of 's three leading newspapers, all established the founding rs of the , until its closure in 1956."
1247,36,"The Welsh Church - 320 LaT Street: The first free dispensary for women in 1896 was set up here. In the first 3 months the clinic treated 2,000 women and children. This led to the establishment of the Queen  Hospital."
1248,3,"Republic Tower - corner LaT and Queen Street: Public art where you would normally expect giant billboards. Designed by  architect Nonda Katsilidis, many internal artists have had their art featured here."
1249,1,Gallery of street art: Take a wander down this public gallery of street art. All sorts of curious and interesting pieces guaranteed to raise your eyebrows in surprise and wonder.
1250,17,View to the  up the  River: View to the  up the  River
1251,26, Ponds Creek Path:  Ponds Creek Path behind the  Studio
1252,5,Bolte Bridge: The Bolte Bridge carries vehicles over the  River.
1253,0,Welcome swallows: Bird life from under the Bolte Bridge
1254,5,"Ron ssi Snr Park, : Ron ssi Snr Park looking tos the Bolte Bridge"
1255,9, Studios and  Star Wheel:  Studios and  Star Wheel
1256,9, Star Observation Wheel:  Star Observation Wheel
1257,2,Harbour Town : Harbour Town is full of bargain shops and eateries
1258,5,Ron ssi Snr Park map: Ron ssi Snr Park map
1259,7,Children's park: Spectacular children's park at the end of  Dr.
1260,23,Pardalot Lookout: A view over the valley with the Rocky River below.
1261,17,Rocky River cascades: A beautiful spot to take the pack off and be caressed by the sounds of the river.
1262,20,Cup Gum Campsite: Ultra-modern facilities await the hiker.
1263,4,Maupertuis Bay: The magnificent sight that awaits following the Rocky River to its ocean outflow.
1264,39,Cairn for the  Sloy (1899): A reminder of treache cions that awaited Nineteenth Century travellers on sailing ships.
1265,43,Cape Du Couc in the distance: The station can just be made out in the distance on the Cape.
1266,35,"Cape Du Couc: Location of the station and Admirals Arch, a 9 km side track to the KIWT."
1267,33,Remarkable Rocks: What can happen to 500 million r old granite when exposed to coastal erosive forces over millenia.
1268,4,Cape husband: The point at which the track heads inland through coastal woodlands.
1269,4, Bay: A killer seascape.
1270,4,Grass Lagoon: The last body of inland water before the track heads back inland to its finish at  Hill Caves.
1271,35,Park Entrance: Catch Bus 235 or 606 to get to the Entrance.
1272,32,Disused Rail Line: Cross Rail were left
1273,6,Pond: Walk off main road past pond to end of path.  The pond is usually filled with water and birds. Seat provided.
1274,44,Walk Bridge: Go left at end of path onto road down to walk bridge over  lake. At the end of the bridge continue left to the windmill.
1275,43,Working windmill: The windmill is used to shift water from  lake storage to ponds and bngs around the park
1276,16,Highest point: At the windmill make a righthand turn up  to the highest point of the park to enjoy   lake and bridge views. There is a seat provided. Retrace your steps to the windmill.
1277,13,Freshwater lake: Great spot to view birds and sculptures. There is also a picnic table on the right.
1278,44,To the : Continue along the road across the intersection to the track on your right to the  edge
1279,13,The : The rare . The lake is best viewed in the warmer months at the alga is heat sensitive. Continue left around the lake enjoying the views and photo opportunity.
1280,11,Revegetation: Enjoy the revegetation of Westgate Park. The Friends Group plant approximately 20 000 plants and 300 species in the park annually.  Continue around the salt lake edge to the grass area.
1281,35,Todd Road car park entrance: Great views across the grassed area to the  lake and Westgate Bridge.
1282,13,Why?: Why is the lake pink?
1283,6,"BBQ: Time to relax. Shelter, toilets and seats. 
Continue right on the lower path past  lake.
Take the side trip to theft viewing platform.
A seat to view the often nesting  provided."
1284,5,Ptype bridge span: After enjoying the  and Westgate views continue left through the grasslands under the ptype bridge span and notice board. The structure can be climbed to provide s.
1285,0, Viewing: There is a good viewing platform from which to watch the birds.
1286,44,"Friends : Continue back to path to the crossroad, pass through the gate posts and past the ""Friends of Westgate Park"" compound. Volunteers meet 8.30am every Monday and Tuesday come and enjoy the fun!"
1287,32,Propagation : Hardwork in the nursery or just having fun? Continue past the nursery to the disused rail line back to the bus terminus.
1288,0,"s: If you are quiet and look carefully, you can often see a variety of reptiles, such as this magnificent B Tongue ."
1289,10,Start of walk: Walk through the  Foreshore Camping Reserve to reach the start of the walk. It's obviously signed and the track is easy to follow.
1290,28,So much to see: The plants are varied and colourful so there's lots to see and touch along the way.
1291,4,Beach view: The tide was out when we went so we could see sand practically all the way to the horizon.
1292,5,Board walk: Takes you across the creek.
1293,4,"Check out the crabs: If the tide is out, it's possible to spot see and hear the tiny mud crabs as they climb in and out of their holes. Looks like synchronised mud dancing - quite mesmerising after watching for a while. "
1294,22,Views: More lovely views
1295,15,Shade: Some welcome shade from the sun!
1296,4,View to the sea: The sea is very far away at low tide!
1297,4,Take a walk on the beach of course: And dip your feet in the water if you're into that too.
1298,4,Pink crabs: We watched these little pink crabs for a while too. They're a bit tickly if you pick one up and put them on your hand (gently of course)!
1299,4,Looking back: A great view across the sand. What a lovely beach!
1300,8, Botanical Gardens: The Gardens date back to 1858. Wide lawns slope down to the  River. There are 17 trees listed as significant by the Nal Trust.
1301,19,Historic weir: The remains of the swimming pool formed between 2 weirs. 1935 has been cut into the base of what was the diving tower.
1302,14,"Our Lady of the Rosary: A beautiful church, with fantastic wrought iron gates (one of the many historic buildings in the area)."
1303,2,ieur Pierre's: A great coffee stop!
1304,48," Town : There are lots of activities happening at the Town  - festivals, workshops, performances."
1305,12,After Black Saturday Memorial: A beautiful mosaic to commemorate the fire in  and surrounding areas in 2009.  (see side of Town  building).
1306,18,Post office: This post office was built in the 1870s and continues to function as one today.  The c tower helps the locals keep to the same time!
1307,13,Puffing Billy  station: A from Puffing Billy  station after your journey from . Emerald Lake Park is a great spot for a stroll and a picnic lunch.
1308,5,Trestle Bridge over Lake Treganowan: Trestle Bridge over Lake Treganowan
1309,13,Lake Treganowan: Lake Treganowan
1310,1,"Emerald Lake Park Murals: Murals depicting Carl A. Nobelius, the Puffing Billy Railway and portraits of four writers associated with the area."
1311,13,"Gus Ryberg : The largest and main , the Gus Ryberg, located north of Lake Treganowan, is named after one of the original park rangers."
1312,13,Path beside Lake Treganowan: Path beside Lake Treganowan.
1313,13,Path to Emerald Lake Rd: Path to Emerald Lake Rd
1314,19,Swimming pool: Swimming pool
1315,0,Moorhens and ducks: Moorhens and ducks
1316,13,Map of Emerald Lake Park: Map of Emerald Lake Park
1317,0,Ducks: Ducks
1318,2," Library and Community Centre: This great community hub features an impressive range of activities including women's only fitness classes, craft, music, ing, playgroup, computer and English classes, and much more."
1319,6,"Alfred Park: Lovely park with BBQ, playground, water , shade and seating."
1320,0,"Skel Creek wetland area: Lovely views of the wetland, complete with croaking frogs and chirping birds."
1321,20,"Gum trees : The variety of genous flora is spectacular, especially in spring when flowers are in bloom."
1322,49,Dairy s Park: Formerly a b stone dairy owned by the Leake family. The area was severely affected by bush fires in 1969. The remaining b stones commemorate the heritage of the area.
1323,56,Rose Grange Boulevard Park: Pack yourself a picnic and have a seat in this lovely pergola. The park also has a playground.
1324,0, Creek Wetland: A shady spot to take in the scenery.
1325,0,Sculpture: This pelican welcomes you to the start of the wetland walk.
1326,0,2 ducks scultpure: See if you can spot the 2 ducks hiding behind this wetland.
1327,41,"Seasons Park: A fabulous park with playground, tennis courts, amphitheater, water , BBQ and seating. "
1328,0,Eagle: Watch out for the eagle soaring above you!
1329,0,Pelicans: These two fantastic birds farewell you as you complete the wetland walk.
1330,8,Retirement Village: Sneak a peek through the fence to marvel at the pretty gardens and immaculate lawns in Lifestyle Seasons Retirement Village.
1331,0,Long view of start of walk: first view of  and wildlife
1332,5,Approaching first bridge: First of many 
1333,22,Over the Bridge view: Rest spot and lovely view of waterway
1334,5,Looking out over the bridge : Bridge looking over of the thriving water rushes
1335,0,Another beautiful view to look at more wildlife: Waterway home to nume bird life
1336,7,Play time: Perfectly situated playground
1337,6,BBQ and drink stop: Right next to the playground is the family BBQ and drinking tap.
1338,24,Looking back at the last bridge: Just taking time to look back at the waterway and bridge
1339,22,View of the end  before turning aorund: Picture actually taken from the other side of waterway. Shows the view and distance to the end of the walk before you turn around and enjoy these views all over again.
1340,16,"What are you looking at?: A deful aspect to this ride is the experience of being in the middle of a busy farming community, including the cattle industry with its curious cows."
1341,16,"The Great Dividing Range: Along the way, you have excepl views of what is ia’s most substantial mountain range and the third longest land-based range in the world."
1342,15,"Take a seat: Sometimes it’s worth stopping for a rest, and there are nume seats on the Trail to do just that."
1343,40," Hotel: The  Hotel is a famous example of colonial architecture. Coupled with great food, this is a place not to be missed (at 4 - 6 -Seaton Road)."
1344,54,"You might meet some horse riders: The Rail Trail introduces you to so many fascinating elements, including stopping along the way to chat to some happy horse riders."
1345,31,"Port of Maffra: A part of the fascinating fabric of the town today, this historic port was a key piece of economic infrastructure in the early days of European settlement."
1346,44,"Boulevard of trees: Travelling through the parklands of Maffra is truly deful, with well-established tree arches that take your breath away."
1347,21,Explore the history: The historic courth in Maffra is a good place to visit not only for its architectural significance but because it doubles as an information centre.
1348,3,The Old Courth Inform: Old Court H Visitor Centre on the corner of the  and Main St. It is open a minimum 11am to 3pm most days. The building is still in perfect cion with the original cell b.
1349,7, Park:  Park where there is a children’s playground and barbes all surrounded by a fort-like wall.
1350,12, Football Disaster of 1892 monument: On the corner of the  and Schnapper Point Drive is a monument to the  Football Disaster of 1892 where 15 members of the football club drowned after the 'Process' sank.
1351,35, Park: G entrance to  Park
1352,24,Schnapper Point walk: Boardwalk at Schnapper Point
1353,24,Schnapper Point steps: Schnapper Point stone steps down to Schnapper Point Drive
1354,31, from  Pier:  from  Pier
1355,31, Pier:  Pier
1356,12,Monument to Matthew : Monument to Matthew 
1357,0,A friendly seagull: A friendly seagull
1358,4,Colourful bathing boxes on the beach: Colourful bathing boxes on the beach
1359,9,Scrubby path: The scrubby path is the only way through as the foreshore is inaccessible at the water.
1360,23,View back to  : View back to  
1361,4,Wooden steps to the foreshore: Go down the wooden steps to the foreshore again.
1362,5,Bridge at the Tanti Creek: Bridge at the Tanti Creek
1363,31, Lifesaving Club:  Lifesaving Club
1364,4,Bathing boxes: Colourful bathing boxes aplenty on  beach
