,Topic,Count,Name,Representation,Representative_Docs
35,34,29,34_fishing_trout_fish_lagoon,"['fishing', 'trout', 'fish', 'lagoon', 'anglers', 'spit', 'steampacket', 'azure', 'kingfisher', 'buoys']","['The river: Provided food including crayfish, red fin, yellow belly, cod as well as possum, turtle eggs. , duck, crane and other birds and their eggs. The women predominately fished whilst the men ', 'Gone fishing: Anglers can choose from one of five fishing platforms, with the  Valley Fly Fishing Club and Associated Angling Club regularly stocking the lake with  trout and redfin.', ' Fly Fishers and Trout Anglers Club: Due to the drought trout fishing has not really been possible.  With  now having water and fish added, trout fishing has once again become popular']"
36,35,29,35_primary_school_preschool_kindergarten,"['primary', 'school', 'preschool', 'kindergarten', 'kathleen', 'dinjerra', 'schools', 'students', 'holy', 'ballet']","[' Primary School site: The site of historic  Primary School (No. 764), built in 1868. This g school was damaged in the 1985 fire but, allegedly demolished and removed before restoration assessment was made. ', ""Upper Gully primary school: This  slope was the site of Upper FT Gully primary school until the school moved to Talaskia Rd in 1963. Kids could watch 'Puffing Billy' laboring up the slope from their playground\n"", 'Dinjerra Primary School: Dinjerra is proudly multicultural with over 25 different nalities represented among the student cohort. Classes are kept  small to maximise teaching and learning. ']"
37,36,28,36_dog_dogs_leash_pooch,"['dog', 'dogs', 'leash', 'pooch', 'bags', 'lead', 'let', 'legged', 'vet', 'stead']","['dogs off leash area: Area where you can let your dog off the lead. It also has a creek.', ""Dog walkers' dise: The Crinigan Reserve is an extremely popular place to indulge your pooch in an enjoyable walk, but please keep your furry friend on a leash at all times."", 'Dog park: Two fenced dog parks with multiple access points. One is for smaller dogs and one is for larger dogs. Both parks have water, plastic doggy bags, bins and seats.']"
38,37,25,37_olive_strip_moments_poinciana,"['olive', 'strip', 'moments', 'poinciana', 'dobsons', 'iramoo', 'vas', 'agricultural', 'grasslands', 'nature']","['Iramoo Grassland: The largest of the three, Iramoo is home to the Striped Legless . The striking thing is the expanse of space and the big sky, with grasses gently swaying in the breeze.', 'The Grassland Reserve: Grasslands are critically endangered. This area is being cared for by weed control, burning and revegetation. In Spring it is a mass of  wildflowers. Cup Day would be a good day to come for a look.', 'Chandler oak: William Chandler planted an acorn beside Dobsons Creek in 1875 to mark the birth of his son, Archibald. Dobsons Creek has the highest ecological vas of any  of  waterway. ']"
39,38,25,38_pool_aquamoves_swimming_swim,"['pool', 'aquamoves', 'swimming', 'swim', 'sadler', 'creche', 'olympic', 'pools', 'waterworld', 'swimland']","['Aquamoves: Aquamoves is an aquatic and leisure centre with facilities such as gym, creche sauna, indoor and outdoor pools. ', ""Paul Sadler Swimland brook: Paul Sadler Swimland has received many as in ia and USA, including the induction of Paul Sadler into the ian Swim Coaches and Teachers' Association  of Fame. Call while it's hot!"", ' Aquatic Centre: The outdoor 50m  pool was built in 1957 after the  Olympics, the smaller pool  in 1968 and the indoor heated polls in 2006. Also includes gym, Recreation , Creche and cafe']"
40,39,24,39_pier_altona_port_kiosk,"['pier', 'altona', 'port', 'kiosk', 'cunn', 'ferguson', 'yacht', 'pylons', 'princes', 'angling']","[""St Kilda Pier: home of the famous Kirby's Kiosk.  Beyond the kiosk is the  - home to St Kilda's own  colony.  If you keep your eyes open around dusk you may see them swimming home to roost."", 'Princes Pier: Built between 1912 and 1915, Princes Pier was the third major pier constructed at Port  and served as a major passenger terminal.', 'Town Pier - now the Port  Yacht Club: Black coal arrived here from . Town Pier was the first significant pier structure in the early settlement of Sandridge. It was demolished in the 1950s. ']"
41,40,24,40_toilets_toilet_public_showers,"['toilets', 'toilet', 'public', 'showers', 'clean', 'amenities', 'basll', 'rules', 'stables', 'unisex']","[""Public toilets and drinking : Phew! It's a pretty steep ramp that leads you up here. A convenient toilet stop and a chance to top up your water bottle before heading off again. "", '19. Underground public toilets: The underground public toilets, built in 1939, are one of eleven built in  in response to public demand for public toilet facilities in  that were both sanitary and discreet.', 'Toilet B and Tourism Map: There is a brick toilet b that is well kept, clean and concrete floor.  It is located in easy walk from the carpark and BBQ area and wheelchairs are well catered for.']"
42,41,24,41_hotel_hotels_hardiman_harp,"['hotel', 'hotels', 'hardiman', 'harp', 'mecure', 'erin', 'bull', 'job', 'railways', 'photos']","['Harp of Erin Hotel remains : The bustling Harp Of Erin Hotel remained in business from the late 1800’s until the early 1900’s, finally falling into disrepair. There are only a few bstones remaining now. ', ""YWCA's Jasper Hotel - 489  Street: The YWCA provided services to women such as housing, job placement and mentoring. Inside is a plaque acknowledging  Henry, pioneer journalist and unionist. Now a hotel and conference venue."", 'Shamrock Hotel - corner Pall Mall & on St: Built in 1854. The gold miners who came to see a show allegedly threw gold nuggets at the feet of a performer one night. Hotel staff later picked them up as tips! What a great job!']"
43,42,22,42_gym_exercise_equipment_outdoor,"['gym', 'exercise', 'equipment', 'outdoor', 'consists', 'fitness', 'ups', 'gear', 'crunches', 'equipments']","['Outdoor Gym: The next outdoor gym station at Liberty Avenue near Magna Place consists of step ups, pull ups, leg raises and a stretch station. ', 'Outdoor gym: Check out the basic exercise equipment on the path and at a few pull ups or crunches to your walk', 'Outdoor Gym: The Liberty Avenue outdoor gym consists of a body twist, multi bars, eliptical trainer and leg press. It also features a set of instuctions on how to use the equipment. ']"
44,43,19,43_blind_spring_goat_trail,"['blind', 'spring', 'goat', 'trail', 'creek', 'crosses', 'group', 'friends', 'shared', 'deck']","['Blind Creek Trail shared path: Enter off  Road and follow the trail along to  Road.', 'New path, connecting the  Creek Trail with the Main  Trail: Look left here to see the new path to the Main  Trail, via  Waller Reserve.  This path is due to open to the public in 2017, though it is already well-trodden. ', 'Friends of  – Blind Creek  Group: This group assists with the implementation of the Blind Creek  Management Plan. The Blind Creek  Group meet regularly & conduct weng, rubbish removal and genous planting. ']"
45,44,18,44_wildflowers_wildflower_daisies_yam,"['wildflowers', 'wildflower', 'daisies', 'yam', 'flowers', 'daisy', 'fingernail', 'edgars', 'bumpy', 'peculiar']","[""Wildflower 4: These are s. I have them in my front yard. The purple flowers are great. Plus, they're a very  plant that will grow in the toughest environment (eg. my front yard)."", 'Wildflower 7: These are tiny flowers we found along the path. They are very dainty and easily missed, or trampled on! They were the size of a fingernail.', 'Yam Daisies (also known as Murnong and Native Dandelion): Yam Daisies are an an ble genous plant. They have been planted here by the Merri & Edgars Creek Confnce Area Restoration Group. Look for the cluster of plantings south of  Road.']"
46,45,17,45_tower_towns_pumped_pump,"['tower', 'towns', 'pumped', 'pump', 'supply', 'water', 'pumping', '1957', 'electri', '18x15']","[' Railway Station Water Tower: Built in 1870 to supply water to steam trains, the 18\'x15\' tower was made from locally made bricks, with 27"" thick walls. Water was pumped from the  River. ated to the EPA in 1972.', 'The Old Water Tower: Used to store the town’s water supply (pumped from the ). The pumping station was on rails to move up the bank in times of flood. The station also produced the town’s electri until 1948.', 'The Old Water Tower: Used to store the town’s water supply (pumped from the ) the pumping station was on rails to move up the bank in times of flood. The station also produced the town’s electri until 1948.']"
47,46,17,46_square_bowl_albanian_music,"['square', 'bowl', 'albanian', 'music', 'outing', 'events', 'myer', 'sidney', 'carols', 'arts']","['Sidney Myer Music Bowl: Attend the free Wellbeing music concert at the Bowl at 12pm after the walk to celebrate the wellbeing of Aboriginal and er people. ', 'Sidney Myer Music Bowl: The Sidney Myer Music Bowl is a very large outdoor venue - home to Carols by Candle on Christmas eve.', 'Albanian Mosque: The Albanian Muslim community formed the Albanian ian mic Society in 1963 to preserve culture & identity and promote mutual understanding, harmony and cooperation within the local community']"
48,47,17,47_tramway_formation_grub_tramline,"['tramway', 'formation', 'grub', 'tramline', 'expensive', 'shows', 'hopper', 'materials', 'branch', 'cutting']","['Tramway display: This static display shows the type of stone hopper used on the narrow gauge horse-drawn  tramway. The hopper was manufactured in Leeds UK', 'Tramway formation: The 4WD track visibly becomes a former tramway at about this point. The formation is dug into the steep hillside, which is unusual as such excavation was of course expensive', 'Tramway cutting: Tramline track does not follow the course of the old tramway at this point. The cutting on the right shows where it went. Cuttings were rare on tramways as being expensive to escavate by hand']"
49,48,17,48_railway_station_magic_train,"['railway', 'station', 'magic', 'train', 'travelled', '1278', 'radio', 'renamed', 'runnymede', 'signal']","['Magic 1278 transmission towers: These radio broadcast towers were constructed in the 1970s for AM radio Magic 693. Today operated by Magic 1278, transmissions from here are so powerful they can be picked up (just) in Antarctica!', ' Railway Station: Opened 1870, originally named Runnymede Railway Station, the station was renamed  Railway Station in 1876. The Queen travelled by train through  on her 1954 tour.', ' Railway Station: Opened 1870, originally named Runnymede Railway Station, the station was renamed  Railway Station in 1876. The Queen travelled by train through  on her 1954 tour.']"
50,49,17,49_gallery_arts_galleries_spire,"['gallery', 'arts', 'galleries', 'spire', 'aka', 'lap', 'phar', 'museum', 'ceiling', 'skel']","[' Arts Centre and Cafe: In 1966, an art gallery and theatre were added to Rio  h and the whole complex became known as the  Arts Centre and was officially opened by Sir Henry Bolte in November 1966. ', ' Museum: The museum has eight galleries, including one just for children. Highs include a complete skel of a b w, the aka Aboriginal Cultural Centre, a living rain and Phar Lap.\n', '12.  Museum: The museum has eight galleries, including one just for children. Highs include a complete skel of a b w, the aka Aboriginal Cultural Centre, a living rain and Phar Lap.']"
51,50,16,50_aboriginal_gertrude_established_koori,"['aboriginal', 'gertrude', 'established', 'koori', 'health', 'service', 'political', 'homeless', 'kollij', 'combat']","['The Koori Club, 43 Gertrude St: Established by Aboriginal artist, Lin Onus, this was a social and political meeting place ng the 1960s for  people infnced by the Black Power Movement.', 'Fitzroy Stars Aboriginal Community Youth Club Gymnasium: The Youth Club gym (184-186 Gertrude St) was established in 1977 as a preventative health program to combat the increasing drug and alcohol problems within the metropolitan Aboriginal community. ', 'Koori Information Centre, 120 Gertrude St: Established in the early 1980s, this was an effective coordination centre for Aboriginal political activity that eventually attracted unnted covert surveillance by federal police.']"
52,51,16,51_coal_miner_mine_miners,"['coal', 'miner', 'mine', 'miners', 'noisy', 'mining', 'charcoal', 'mines', '1909', 'kiln']","['Nos. 9 and 10 shafts: Together these mines covered an area of almost 200 hectares. That\x9ds 160 underground cricket grounds! The coal has gone but this concrete shaft remains.', 'Shaded rest area: A quiet spot to sit under the trees and imagine the noisy steam locomotives chugging right past you, laden with coal from the State Coal Mine.  ', ""Tent Town : The site where 12 miners first lived when the State Coal Mine opened in 1909. By mid 1910 the township of  was established with the construction of 100 miners' cottages. ""]"
53,52,16,52_conservatory_ford_recital_sites,"['conservatory', 'ford', 'recital', 'sites', 'sub', 'ngv', 'potter', 'headlines', 'leachs', 'bitten']","[""Ford Comes To Town: In 1925, Ford announced that  would be the ia's  headquarters for Ford. The 'Whole town is s' was the newpaper headlines with the  of increasing employment for the area."", 'Ringwood Fire Station: Cross the highway and head west. The former Ringwood Fire Station was built in 1930 at a cost of seven thousand pounds and provided an important service for over 65 rs. It is currently a restaurant', ""Conservatory Gardens: Established in 1901 and home to ia's oldest glass hoth, and the sculpture of a man fighting a leopard being bitten by a dog! Water tap is at the rear of the gardens tos Rosalind Park.""]"
54,53,15,53_permian_million_ago_basalt,"['permian', 'million', 'ago', 'basalt', 'ntal', 'icesheet', 'conglomerates', 'canyon', 'ochre', '270']","['The Organ Pipes: More than a million rs ago, lava from nearby volcanoes flowed into the area, cooled, ed, then cracked, forming the columns that we see today. ', 'Permian Pavement: This sheet of rock is covered with p scratches. ""So what?"", you say. Well, they were only made by a ntal ice-sheet that covered ia and Antarctica 270 million rs ago.', 'ett Cove Beach: Looking from the cafe, along the beach. Those s  were dropped there by the melting of a ntal ice-sheet at the end of the Permian era some 270 million rs ago!\n']"
55,54,15,54_lookout_mt_rock_strezlecki,"['lookout', 'mt', 'rock', 'strezlecki', 'cliffs', 'ranges', 'height', 'massive', 'rails', 'pardalot']","[""Lookout: There are plenty of natural lookouts on this walk (huge rocks to sit or stand on), but there's also this more convenl one.  Great views of course, especially of  off to the south."", 'Lookout rock: Just off the track to the right is a massive rock, providing a great natural lookout through the ranges to the north', 'Safety rails can be handy: The Lookout track is secured by safety rails, which provide a welcome degree of reassurance as you head tos the lookout.']"
56,55,15,55_canopy_spinebill_transition_heathlands,"['canopy', 'spinebill', 'transition', 'heathlands', 'sprayed', 'schlerophyll', 'rebushing', 'rejuvenating', 'parklandwide', 'spent']","['Heathlands: The last section of the walk winds along the edge of beautiful native heathland that supports a wide variety of fauna. A large section of heathland is fenced off for conservation.', 'Rio  Park :  West Primary School spent five rs rejuvenating this area of the park. There is lots of native bush and many signs cating types of plants, trees, etc. Take your time to wander. ', 'Hideaway: This is a cooler spot to rest, hidden in the lush ferns and overhanging foilage. The trail is in a sir state of transition today, after being reconstructed following the Black Saturday bushfires.']"
57,56,14,56_jac_treescape_log_mighty,"['jac', 'treescape', 'log', 'mighty', 'logs', 'tells', 'fallen', 'annual', 'climbing', 'record']","['stand of pine trees: a lovely area for the kids to play among the pine trees, including a great big climbing tree. Just be wary for hazards here such as barbed wire.', ""Jac: Stop in at the mighty Jac tree on the left. What stage of its annual life cycle is it up to? 't forget to record what you see on the CteWatch app or recording sheet."", ""Jac: Stop in at the mighty Jac tree on the right. What stage of its annual life cycle is it up to? 't forget to record what you see on the CteWatch app.""]"
58,57,14,57_oval_football_rules_manicured,"['oval', 'football', 'rules', 'manicured', 'hurt', 'scoreboard', 'afl', 'permanent', 'mcg', 'competition']","['VFL Park: This arena was to be the home of ian Rules football, staging the G Final and provided with its own rail line. Today, a moldering section of gstand is all that remains', 'Football oval: If you are walking along this path, why not stop for a kick of football on the way. The oval is well manicured and is home to permanent AFL posts. A little friendly competition never hurt anyone...', 'Football Oval: If you are walking along this path, why not stop for a kick of football on the way. The oval is well manicured and is home to permanent AFL posts. A little friendly competition never hurt anyone...']"
59,58,14,58_jetty_ws_punt_bench,"['jetty', 'ws', 'punt', 'bench', 'yourlegs', 'humpback', 'near', 'close', 'wirringgal', 'yalam']","['Jetty and Picnic Bench: Right near the Bidjin sign is a jetty and picnic bench where you can enjoy a peaceful rest.', 'Jetty and Picnic Bench: Located just near the Wirringgal sign is another opportunity to enjoy a rest or walk along the jetty', 'Jetty and Picnic spot: Located near the Yalam sign is another opportunity to enjoy a walk out close to the water and chance to rest yourlegs and enjoy a snack.']"
60,59,14,59_hill_ascent_summit_stabilisation,"['hill', 'ascent', 'summit', 'stabilisation', 'klings', '360', 'apollo', 'uphill', 'rolling', '700']","['Hill stabilisation works : Build on an old tip, this hill is prone to slipping.  New stabilisation works and planting will keep  in place. ', ' hill for rolling: There should be more  hills like this one in the centre of cities. Watch the number of kids who are immately drawn to it and roll down laughing.', ' hills summit: The trig point marks the highest point of this range, with fine views through 360 deg, including  to the south, and the  of the north-west. The view is worth the 700 m walk']"
61,60,14,60_wild_notforprofit_engagement_website,"['wild', 'notforprofit', 'engagement', 'website', 'nature', 'connecting', 'specialising', 'dcated', 'completed', 'please']","['Wild : This walk was completed by Wild , a not-for-profit specialising in nature engagement and dcated to connecting people with nature. Please visit our website to find out more.', 'Wild : This walk was completed by Wild , a not-for-profit specialising in nature engagement and dcated to connecting people with nature. Please visit our website to find out more.', 'Wild : This walk was completed by Wild , a not-for-profit specialising in nature engagement and dcated to connecting people with nature. Please visit our website to find out more.']"
62,61,13,61_bakery_vietnamese_bun_rolls,"['bakery', 'vietnamese', 'bun', 'rolls', 'grocery', 'pho', 'salad', 'savoury', 'crust', 'sweet']","['Chilli bakery: I usually have an egg and salad roll from here, though there are many variations to choose from.  There is a  wait as this is probably the most popular place for Vietnamese rolls in the area.', 'Ha Noi Pho: Tucked in a laneway is my favourite Vietnamese restaurant.  The owner Dao is lovely and hospitable.  The pho is terrific. My favourite dish is lemongrass beef wrapped in vine leaves.  ', ' Crust Polish Bakery:  Crust Bakery is  family owned and operated. The Bakery makes great cakes, biscuits, pies, sweets, soups, salads, bagels, cabbage rolls, pierogi and much more']"
63,62,13,62_rockpools_pools_blowhole_rock,"['rockpools', 'pools', 'blowhole', 'rock', 'sandys', 'rocks', 'crystal', 'fall', 'shower', 'worms']","['Rock pools: See what sort of shells and stones you can collect. Can you find a bright red sea star? You can see all sorts of sea vegetation, small fish and crabs. Look at the bird life, gulls and cormorants.', 'Wonderful rock pools: The rocks are covered with green and red algae which shelters a range of invertebrates including brittle stars, bristle worms and crustaceans.', 'The Blowhole: The Blowhole is a remnant of the gold rush, created to expose gold in the water, and after heavy rainfall it appears to shoot water. Unfortunately, it is currently closed due to a recent rock fall.']"
64,63,13,63_orchid_orchids_waxlip_43,"['orchid', 'orchids', 'waxlip', '43', 'hyacinth', 'roseum', 'specimens', 'sp', 'fringing', 'nodding']","['Nodding Greenhood Orchid: These beautiful orchids are found in the eastern states of ia, and flower in winter and spring.', 'Waxlip Orchid: The Reserve is home to 30 different types of orchids, including this beautiful Waxlip Orchid ( Major). It flowers in late winter to early spring, and is found in heath land and open s.', 'Native orchids make for a special treat: Throughout the r, over 43 orchid species including sun orchids (Thelymitra sp.) produce the most exquisite flowers at specific times of r.']"
65,64,13,64_smoking_aboriginal_interpretive_ceremony,"['smoking', 'aboriginal', 'interpretive', 'ceremony', 'gippslands', 'yorta', 'gippsland', 'stories', 'welcomes', 'walker']","['Smoking Ceremony: Experience a tradil genous Smoking Ceremony in the midst of the ancestral lands of  nation (allocated times).', 'genous history: A number of interpretive signs explain the local genous history, creation stories and artwork of the Gunaikurnai, one of the Aboriginal nations of ia. ', 'A rich fabric of history: Settlement stories are told through both photos and text, starting with the ive squatters who came south over the Victorian Alps to settle in the central Gippsland Plains and beyond.']"
66,65,13,65_market_meat_queen_1878,"['market', 'meat', 'queen', '1878', 'largest', 'class', 'victoria', 'trades', 'qv', 'trade']","['Queen Victoria Market: The Queen Victoria Market, established in 1878 is the largest market in ia and one of the largest in the world. Many of the buildings are still used in trade today. ', 'Queen Victoria Market: The Queen Victoria Market, established in 1878 is the largest market in ia and one of the largest in the world. Many of the buildings are still used in trade today.', 'Queen Victoria Market: The Queen Victoria Market, established in 1878 is the largest market in ia and one of the largest in the world. Many of the buildings are still used in trade today.']"
67,66,12,66_library_kensington_neighbourhood_knh,"['library', 'kensington', 'neighbourhood', 'knh', 'brook', 'borrow', 'education', 'programs', 'literacy', 'u3a']","['State Library Victoria: The State Library is a popular spot for lounging on the lawns at lunchtime. The free wifi is an added attraction. It also holds many talks, discussions and exhibitions, which are usually free.', 'brook Library: This library is buzzing with families reading and learning together. The friendly staff are happy to help with information. There are books available to borrow in Vietnamese, Chinese and English.', ""Kensington Neighbourhood H (KNH): KNH runs various activities including vocal education, English language lessons, digital literacy, arts and crafts, social groups, weekend workshops and children's activities etc etc""]"
68,67,11,67_weir_turbine_generation_diving,"['weir', 'turbine', 'generation', 'diving', 'pictureview', 'contraption', 'aug', 'waterslide', 'weirs', 'collects']","[' 11: Completed in 1928. Paddle steamers still pass through the  daily. The  system is the only site on the River  where a  and weir are seted by an nd. Image: Construction 1927', 'The Weir: This Weir has been here for a fair while, and nearby is a strange bstone box contraption that was probably a sheep dip. Cng over takes you to a silcrete quarry. Beautiful red gums abound.', 'Turbine generation: Walk along the lower path to access the turbine generation. At the base of  is a small weir that collects water, sending it down a 300mm-diameter pipe to power this hydroelectric turbine.']"
69,68,11,68_jk_crofton_reservecherry_booth,"['jk', 'crofton', 'reservecherry', 'booth', 'turnstile', 'hut', 'reserve', 'exit', 'cubbyh', 'subdivisions']","["" Reserve: If you're in need of more space,  Reserve (on Beach Rd) offers ovals and playing s, a playground, toilets and a take away store, tucked away at the rear of the reserve on O'Connor Street."", 'rt Booth Reserve: Start at rt Booth Reserve. Bus stop on Clow Street. The reserve offers an off-leash dog park, playgrounds, sporting s and an athletics track.', ""Hut - Karen  2000: Hut symbolises the h, the home, the shack, the cubby-h and he hermit's retreat. It also alludes to the potential to dream that is inherent within all of these structures.""]"
70,69,10,69_felltimber_wetland_ducks_swamphens,"['felltimber', 'wetland', 'ducks', 'swamphens', 'ibis', 'tons', 'shoots', 'midwalk', 'waders', 'tot']","['Birdlife: Keep an eye out for Purple Swamphens.  They are primarily waders and feed mostly on  shoots of reeds and other aquatic plants.\r\n', 'Felltimber lagoon: Located next tot he Felltimber Community Centre, this is a peaceful spot to sit by the water. There are many ducks that will approach you - especially if you have something for them to eat.', 'Wetland view: One of several small lakes along the walk.  Each one supports a wide variety of birdlife including Black s, ducks, Purple Swamphens, Egrets, Grebes and Eurasian Coots.  ']"
