,topic,document
3136,5,": A  runs down the side of the bridge, if it's rainy it will flow very quickly!
"
3137,31,Station: Time to head home!
3138,41,Stop by for a quick game of hopscotch!: Why not stop by for a quick game of old school hopscotch! Fun for all ages!
3139,44,Bstone steps: Bstone steps
3140,17,Check out the view!: View out over the  River.
3141,7,Town : The Town  ramp and steps are great fun for er children to swing and play on.
3142,3,Town : Town 
3143,7, Primary School: The  Primary School playground offers open space for playing and a selection of equipment for climbing and other activities. Wall murals engage with local wildlife and sporting traditions.
3144,10,"The trailhead: Here's the start of the 2km trail, it's hidden on the left with a small car park attached. There's a Keppel Falls Lookout 350 metres further along Lady Talbot Drive, not to be confused with this walk."
3145,22,"Roaring river: As you walk, the river will be beside you. Chances are, you'll hear it the minute you start walking on the track. It's a great view from up high on the path."
3146,48,"Afternoon frost: Even if it's sunny, there's a chance you could still see frost on logs and s that are closer to the river. This photograph was taken at 3pm on a sunny autumn day. Brrr!"
3147,20,"Fallen Manna gums: Many trees have been felled in the area, but there's a healthy undergrowth that keeps this walk lush and cool in rature. Admire these once proud Manna gums, tall enough to cross the river twice!"
3148,46,"Signs of regrowth: After the Black Saturday bushfires of 2009, the nal parks have needed to regenerate themselves. Everywhere you look there are signs of the past and future, in the towering trees and vivid ferns."
3149,10,"Keppel Falls: The falls were discovered by the Keppel brothers in the early 1800s. After the rains and the snow melt,  drain the nearby mountains into the  River."
3150,35,"Leave before dusk: This walk takes you down into a valley, so it quickly becomes dark the minute the sun sets behind the mountains. Be sure to head back to the car park before dusk."
3151,2,The Anchorage Restaurant: A view to the  beside the Anchorage Restaurant
3152,12,town Cenotaph: town Cenotaph
3153,31,HMAS : Gem Pier with HMAS  d
3154,6,The rotunda at Commonwealth Reserve: A lovely spot for a picnic in the gardens of Commonwealth Reserve
3155,56,"Wilkinson Memorial Drinking : The Wilkinson Memorial Drinking  sits on the corner of Syme Street and Nelson Place, just in front of the Tourist Information office"
3156,13,J E  Reserve: The most photographed view in  - historic cannon across to the  of 
3157,31,Ferguson St Pier: The view across ships d at Ferguson St Pier to the tall buildings of 
3158,4,Commonwealth Reserve: The seaplane landing looking across to HMAS  and  beyond
3159,21," Arts Centre:  Arts Centre includes a newly constructed Theatre, Art Galleries and the historic Rio  h (originally owned by W.B. ) or grab a bit to eat at the cafe."
3160,4," 11: If your timing is right, you can watch the workings of  11 and see paddlesteamers and boats pass through on their way up or down stream."
3161,19, Weir: See the  Weir in operation as it holds back the water and cascades 3-4 metres to the lower water level downstream.
3162,60,MIldura Rowing Club & lawns: A great place to take a rest and view the might  River.
3163,1,The  Wharf: The old wooden wharf is still used on a daily basis by the local paddlesteamers.
3164,2,"'s Langtree Mall: For all your shopping des, a snack or a meal."
3165,32, view: Part of the amazing  skyline over the tram rails & start of the walk
3166,29,Graham St. Skate Park: Great place to hang out for skaters and amazing graffiti
3167,41,Morris Reserve: Tennis court and funny little playground
3168,8,Garden  Reserve: Beautiful park for a pick-nick and some playtime
3169,3,"1st h: The Port  hs were built in 1924, and in conjunction guided ships. They have been preserved as part of a new housing estate that has transformed the old industrial port area."
3170,1,"2nd h: The tower used to show a fixed green  over a 26 degree sector, whilst a second green  every six seconds in the four degree sector marking the center of the Port  Channel."
3171,2,"Restaurants and cafe's: With so many places to go, it's hard to choose. Enjoy your break!"
3172,6,Spirit of ia: A buzzing place when the ferry just arrives or almost leaves. Wave people goodbye who go back to ia or just starting their holidays!
3173,2,Typhoon Cafe: **Opl Resteraunt
3174,2, Wholefoods & Bulkfoods: Sells organic and other bits and pieces food items.
3175,2,The Epicurean Delicatessen: Cured meat and cheeses
3176,2,Typhoon Cafe: **Opl restaurant
3177,2,Favourite Flavours: Handmade icecream shop. 
3178,2,Bath Lane: Various cafes and boutiques
3179,2,The Good Loaf: Cafe
3180,2,Indulge Fine Belgian Chocolates: Chocolate shop
3181,2,Turkish Kitchen: Turkish Restaurant. 
3182,2,"Wine Bank On View : Wines and a range of 'nibbles' 

**Not reccomened for children"
3183,40,"The Hotel Shamrock: ** Opl restaurant.

**bookings reccomended "
3184,2,Chancery Lane: Assortment of cafes.
3185,2,Cold Rock Ice Creamery: Icecream shop.
3186,2,"Clogs Pizza & Restaurant: **Opl Restaurant

Mainly Pizza and Pasta."
3187,5,Riverside Bridge: This was rebuilt in 1962.  When water is low stumps of the first bridge can be seen on the north side.  This bridge was subject to regular flooding.
3188,55,Bidjin Sign: The Bidjin (meaning freshwater mussel) sign is from the Wergaia genous language of the Wimmera.  
3189,55,Jetty and Picnic Bench: Right near the Bidjin sign is a jetty and picnic bench where you can enjoy a peaceful rest.
3190,0,Wirringgal Sign: Wirringgal (meaning Golden Perch) is also from the Wergaia genous language.  
3191,55,Jetty and Picnic Bench: Located just near the Wirringgal sign is another opportunity to enjoy a rest or walk along the jetty
3192,10,Yalam Sign: Yalam (meaning Waterhole) is the last of the three genous signs along this particular part of track.
3193,55,Jetty and Picnic spot: Located near the Yalam sign is another opportunity to enjoy a walk out close to the water and chance to rest yourlegs and enjoy a snack.
3194,21,The Capital Performing Arts Centre and  Art Gallery: The Capital Performing Arts Centre and  Art Gallery
3195,3, H:  H
3196,1,Borchelli's Ristorante: Borchelli's Ristorante
3197,3,Buildings at the corner of View St and Pall Mall: Buildings at the corner of View St and Pall Mall
3198,8,Alexandra : Alexandra 
3199,12,Soldiers Memorial Museum: Walk along Pall Mall tos the Soldiers Memorial Museum
3200,21,Visitor Information Centre: Visitor Information Centre
3201,41,Law Courts: Visitor Information Centre
3202,21,Conservatory: Conservatory
3203,12,Memorial to gold: Memorial to gold
3204,8,Chinese Gateway: Chinese Gateway
3205,59,Rosalind Park gate: Rosalind Park gate
3206,59,Conservatory from Rosalind Park: Conservatory from Rosalind Park
3207,34, Primary School:  Primary School
3208,59,Rosalind Park: Rosalind Park
3209,1,Poppet Head: Poppet Head
3210,1,Mosaic under the Poppet Head: Mosaic under the Poppet Head
3211,3,Archway under the Capital Theatre: Archway under the Capital Theatre
3212,10,"Pause Spot One: Take 5 p breaths. What can you
See
Hear
Smell
Touch
Taste
p belly breathing and focus on your five senses. This is a popular way to relax and bring you into the moment"
3213,10,"Pause Spot Two: Looking for Colours.
This can be helpful when your mind is going in circles.
Can you find something that is:
Green
B
Red
White
Yellow
What other colours can you see."
3214,17,"Pause Spot Three: Listening for Sounds
To fully in the moment we need to stop and absorb what is around us.
Listen for these sounds:
Birds 
Water 
People 
Traffic"
3215,10,"Pause Spot Four: Take a moment to be grateful and reflect on your strength.
Say to yourself, I am strong like this tree because ............
Take a moment to be grateful and say to yourself, I am grateful for ......"
3216,10,"Pause spot Five: Count your steps to the next pause spot.
Shift your weight from one foot to the other and walk with awareness one step at a time and count your steps until you reach your next spot."
3217,10,"Pause Spot Six: Congratulate yourself you have reached half way.
You achieve so many things over your lifetime. Take time to acknowledge them. Now turn and walk slowly, mindfully and enjoy the walk back."
3218,16,"Big Hill Track West,  : The walk begins at the carpark for Crusoe  & Number 7 Park. "
3219,9,"Historic Water Race: The track takes you over water races, some empty…"
3220,17,Water Race In Use: some full!
3221,44,Track Intersection: Take the track to the left at this first intersection.   
3222,43,"Water Tank: After the yellow gas pipeline sign, turn right and head tos the water tank."
3223,10,Dam Wall: The track goes between a small empty  on the left and this brick building on the right. 
3224,5,"Old Fence: At this landmark, continue straight ahead."
3225,44,Fork In The Track: Turn right here and continue back to the beginning. The Number 7  will be on your left. 
3226,23,View along the way: Number 7 
3227,40,The Ol' Duke Hotel: The hotel and related buildings are a part of 's history. Enjoy music by an open fire at the Nal Celtic Festival.
3228,3,The Ol' Duke - H Street side: Admire the excellent restoration and redevelopment of an historic building.
3229,21,The  RSL Memorial Garden: This building was formerly a Nal Bank and hs a collection of military memorabilia.
3230,14,"St Patrick's : This church  dating from the 1940s has unusual, harlequin glass windows and is still an important community meeting place."
3231,11,"Tradil timber hs: This is a small enclave of tradil timber hs, especially lovely in autumn when the leaves are on the ground."
3232,25,Intersection of H and Smythe Streets: Be careful cng this road! 
3233,3,Cng Smythe Street: You are leaving behind timber 19th century domestic buildings for large modern mansions.
3234,10,"Arlington Rise Development, turn left at the flags: Experience a good footpath on this side of the road."
3235,15,"Across the roundabout take the ups curving footpath: This path will take you to a deful small rest place and garden, with a spectacular view over  Bay to the You Yangs."
3236,59,The park at the top of : Catch your breath and take a well-earned rest here!
3237,6,"Breathtaking views: A beautiful view at any time, but a great  experience! Return to e Street where there are a number of enticing places where you can enjoy your choice of food and drink."
3238,52,Train Station Precinct: The Visitor Centre located here and can provide loads of information about  and the surrounding areas.  
3239,3,Masonic : Look for this building as you head east on the Western Highway. It’s stand out paint work makes it very easy to spot! Turn left into Queen Street.
3240,3,Langi Morgala Museum: This red brick and bstone building was built in 1874 and boasts a very interesting history.  It opened as the Langi Morgala (Home of yesterday) Museum in 1970.
3241,3,"Astor Cinema: Completed in 1938 in the art deco style, The Astor was one of the largest purpose-built cinemas in rural . It closed with the advent of television, but re-opened in 1959."
3242,3,Shire : The Shire  was built in 1871 – arguably one of ’s most distinguished buildings. The building hs a WW1 honour board and a beautiful stained glass window that honours the fallen. 
3243,12,Cenotaph: The monument was dcated in 1930 to those who served ia in various conflicts and in memory of those who died.
3244,12,"Town  and War Memorial : The Town  was built in 1869. The , planned to mark Queen ’s diamond jubilee, also commemorates volunteers who fought in the Boer War."
3245,40, Street with Vine covered veas:  Street showcases many historic buildings and the vine covered veas of the modern businesses. The first vine was planted in 1874 by Mr Grano outside his mixed business store.
3246,27,Public toilet and seat: Here if you need it! A small detour will take you to the Bull and Mouth Stables.  Built in 1866 these bstone stables were described at the time as “one of the finest in the country”.
3247,12,Nurses memorial – View Point: The memorial was erected to the English-born nurse th Cavell who was executed in 1915 for assisting prisoners to escape from the Germans. Each Anzac day a nurse lays a wreath in her memory. 
3248,18,"Historic buildings - Vindel H: On the northern side of  Street, pass  Vindel H. Constructed in two parts, the Sub-Treasury and Assay office in 1858 – the post office was attached in 1862. The  c was installed in 1890."
3249,10,Water station: A modern and thoughtful addition to the street provides the means for walkers to refresh and refill! Leave the main drag at this point and turn left into Ingor Street.  
3250,8,Gum San Chinese Heritage : This dramatic two-story building with its authentic Chinese tiled roof hs a fascinating selection of audio-visual and static displays. Well worth a visit!
3251,3,"J  - Lunatic Asylum: Completed in 1861, this building was originally a  prison. From 1866 to 1991 was the only institution in  entirely devoted to the care of the criminally insane."
3252,36, H: Completed in 1886 in the Queen Anne style it operated as a general hospital until 1937. Since 1988 it has been used as administration offices and a nurse education centre.
3253,42,"Alexandra Gardens: The Alexandra Gardens is home to the Active Pathway Project consisting a multi use pathway around the perimeter of the lake, two exercise stations, a wetlands boardwalk and better wayfng signage. "
3254,2,"Celebratory Coffee: Head back to your car after leaving the gardens, or if you are in the mood, try Fred and Bet's  for a great coffee and an indulgent treat."
3255,9,"Star reserve: This reserve dates from the 1970s, but contains Aboriginal bush tucker sources, and also remains of the  military camp, built in 1942 to protect  from Japanese invasion"
3256,0,"Tirha wetlands: This wetland is named for the  occupied by Rev. James Clow, first European settler in the  of , 1838. The wetland are  home to much bird life, and aquatic species such as frogs"
3257,32,"incline tramway: This is the only incline firewood tramway in the  of . The home owner has a wood fire or stove, and has constructed a 15 metre winch hauled tramway out of angle iron"
3258,26,Police Road ret basin: This massive retaining wall was constructed in the 1970s for flood mitigation by the  Valley Authority. The DVA was absorbed as part of  Water in the 1990s
3259,43,"Magic 1278 transmission towers: These radio broadcast towers were constructed in the 1970s for AM radio Magic 693. Today operated by Magic 1278, transmissions from here are so powerful they can be picked up (just) in Antarctica!"
3260,11,"Kilcatten Park site: Kilcatten Park  was built by James Quirk in 1856, and home for many rs to the Golding family. The  has now vanished, but exotic fruit trees still mark the site"
3261,30,"VFL Park: This arena was to be the home of ian Rules football, staging the G Final and provided with its own rail line. Today, a moldering section of gstand is all that remains"
3262,15,"Wonderful shady seat: On a warm day, this is a great seat to sit and watch the world go by."
3263,7,The playground: There always seems to be children in this playground.
3264,4,"Looking back to Apollo Bay township: The path looking back to Apollo Bay township, the  knolls make wonderful slopes for rolling down."
3265,22,Heading tos  River: I love this part of the walk where you start to get inviting glimpses of the sea and start wondering what lies beyound the trees.
3266,22,"The  river: Through the shady path and the  river appears, Marengo lies in the distance."
3267,30,"Dogs swimming: Not sure if it is an official dog off leash area, but there always seems to be dogs here."
3268,23,Expansive views and little rock pools.: The ocean and sea breezes (sometimes gales!). The rock formations and great for hopping along and see things in  pools.
3269,0,"Collecting cuttlefish and shells: Lots of things to keep children interested, shells, birds, cuttlefish shells and general stuff to pick up and look at."
3270,1,The : The stonework on the  is truly a work of art!
3271,38,The end of the : Who can resist wallking to the end of the ? Great fishing spot too (caught a flathead there).
3272,0,"Shelterd harbour beach: Beautiful sheltered beach with crystal clear water. When we were there, two nesting Cape  Geese cmae hissing tos us. "
3273,38,"Craypots, fishing boats and anglers.: The piles of neatly stacked craypots and fishing boats in the water are really beautiful."
3274,4,"Apollo Bay beach: The beach is most sheltered nearer the harbour and the swell gets bigger as you walk along the bay. It is a great beach for swimming, body surfing, surfing and flying kites (it can get very )."
3275,29,"The skate park: I love stopping and watching skaters, scooters and bike riders mucking around on the skate park. "
3276,1,The seals sculpture: Next to the Tourist Info this is the first of many fantastic sculptures along the foreshore.
3277,48,"Seat and sculptures: The  area across from the shops is a fantastic place to wander, stop, picnic and sit. If is also quite sheltered from southerly sea winds."
3278,16,"North Boundary Track: Lookout which offers 360 views of the Churchill , & you  can see all the way out to Stud Road"
3279,35,Car Park Entry: There is parking out the front of the park on Churchill Park Drive which offers easy access to the hiking trails
3280,9,Army Track : You'll find many of the trails around the park quite wide with a loose gravel surface 
3281,0,Wildlife: The park has an abundance of wildlife & quite a serene & tranquil place to visit
3282,0,Fauna: The park is full of hidden wonders 
3283,33,"Escarpment: 's Creek cuts through the so-called ""new volcanic"" layer of basalt that makes up most of the terrain of the Western Suburbs. You can see plenty of volcanic features like this outcrop. "
3284,19,"The Weir: This Weir has been here for a fair while, and nearby is a strange bstone box contraption that was probably a sheep dip. Cng over takes you to a silcrete quarry. Beautiful red gums abound."
3285,20,"Native Vegetation: As well as magnificent gum trees, there are native grasses, wildflowers and shrubs.  Council,  Water, and the Friends of 's Creek actively care for the grasslands."
3286,29,Housing: People who live along the creek have been g their backyards their front yards so that they can better engage with their local environment.
3287,26,"Tool Scatters: This whole area is very important for the Marin Bulluk clan of the Wurundjeri people, and has been inhabited for ten of thousands of rs. 's Creek silcrete  is found for kilometres around."
3288,15,Have a seat: Sit on the bench and enjoy the view
3289,0,Wildlife : There is always plenty of birds and animals around. In this case a  Argus butterfly.
3290,11,More trees: This stretch of the creek is particularly blessed with big trees.
3291,33,"Ochre: As we get further downstream, we get per under the basalt, revealing layers of gravel, Silurian bedrock, and this amazing ochre wall."
3292,0,Birds: Red-rumped parrot
3293,15,Up : It's pretty steep up that hill. Have a breather on a sly different seat.
3294,1,Nature's Art: Sculptural forms
3295,10,"View across to the Wheel: A great place to start, if you are going to do a brisk walk, you might want to time yourself to see how fast you go for the next time you do the walk."
3296,6, lunch spot and flower bed: Why not stop and smell the roses? Great water side view on this lawn area makes a pleasant lunch spot.
3297,15,The wide boardwalk: There are quite a few seats or benches along this stretch if you need to take some notes on your walking meeting.
3298,42,"Harbour  : A favourite leg of the walk with many other people out on a lunchtime walk. Time to talk, think or simply turn off and get some exercise.  "
3299,41,"Table Tennis: Anyone for Table Tennis? Bring a work colleague, some table tennis bats and balls  and have some fun! "
3300,1,Cow up a tree: Cow up a tree by John  is a wonderful public sculpture. Look up every time you walk past and see if it makes you smile.
3301,27,Monument Park: Another interesting spot to stop for lunch. Sit on the lawn or bench look at the artworks and enjoy the view.
3302,1,Silence: 'Silence' by Adrian Mauriks is a fibreglass sculpture along New Quay Promenade. It's nearly time to turn around. Why not pick up the pace a little and get the blood pumping?
3303,10,"Looking South: Always nice to look back at where you started, or where you are going!"
3304,45,The Rush Gateway -  Library Gardens: Start your walk under The Rush Gateway. What do the strange shapes on the top mean? 't even think of climbing this as it is huge. 
3305,1,"Chancery Lane artwork: Drop by Chancery Lane and see if you can spot these colourful creations! There's local artwork, coffee shops and clothing boutiques to enjoy."
3306,30,Meet a Chancery Lane resident: Not quite a doggy in the window but you can make friends with this one - he won't bite!
3307,1,Who do you know?: Take a closer look to see who you might recognise on these walls. 
3308,40,Shamrock Hotel - corner Pall Mall & on St: Built in 1854. The gold miners who came to see a show allegedly threw gold nuggets at the feet of a performer one night. Hotel staff later picked them up as tips! What a great job!
3309,27," Visitor's Information Centre - 67 Pall Mall: You can find lots of information about things to do here. There are brochures, displays and more. Toilets are available at the rear of the building."
3310,0," Magistrates' Court , 71 Pall Mall: There are fantastic lions and gargoyles at the front of the Magistrates' Court. How many lions and gargoyles can you see? What are they doing outside the Magistrates' Court?"
3311,21,"Conservatory Gardens: Established in 1901 and home to ia's oldest glass hoth, and the sculpture of a man fighting a leopard being bitten by a dog! Water tap is at the rear of the gardens tos Rosalind Park."
3312,59,"Rosalind Park: The creek was an important source of food and water for the Dja Dja Wrung people who lived in this area. This  woodland with River Red Gums became a gold, then converted into a public park."
3313,37,"Chinatown precinct: Once home to the Chinese miners in , this place gives you a taste of Chinese culture and history. It's also a great space to run around and explore! See how many lions and dragons you can find."
3314,7,Golden Dragon Museum: Dragons are a popular and auspicious mythical creature in Chinese culture. See these fearsome and colourful creatures up close!  Check out the fun activities if you\'re here ng school holidays.
3315,28,Lotus flower: The Lotus flower is often used as a symbol for purity and truth. Can you find the other giant flowers in the area? 
3316,59,Rosalind Park Fernery: Enjoy the cool air as you walk through the fernery. The River Red Gums here are from the original landscape hundreds of rs ago. Look up and see if you can spot a bat or two!
3317,59,"Rosalind Park - resting stop: There are many shady areas where you can stop and have a rest, or simply run around to explore the area."
3318,7,"Playground - open after school hours: Playground heaven! Slides, climbing decks, fireman's pole, , a sandpit, and a large climbing net! Wheelchair accessible in most areas. There's also a drinking  here."
3319,58,"Cascades  and : A cool spot for birds and people to enjoy the park. Built in the 1880s, the original structures fell apart until it was partially rebuilt in 1997."
3320,0,Peter the Rabbit: This Rabbit is called Peter. What's Peter looking at? What\'s he thinking? Who put him here? Why? So many interesting questions for a giant rabbit. If only he could talk.
3321,32, Vintage Trams: If you're lucky you might spot the Vintage Talking Tram Tour. Hop on to join the tour but note that you'll have to stay on till it comes back to this spot again to continue your walk.
3322,5,"Alexandra  - Charing Cross: Imagine having a  named after you. This was named after Alexandra, Princess of Wales whose sons, Princes  and George, attended the opening ceremony on 5 July 1881."
3323,2, Ice Creamery: Check out the many flavours available here. You can sit outside to enjoy your ice-cream while g other people jealous!
3324,1,Pennyweight Walk: A free gallery with fantastically colourful artwork by  local artists. Get your fix of street art here.
3325,6," Information Centre: Open daily daily from 9am to 5pm. There are public toilets, water s, fantastic playgrounds, BBQs and picnic tables near the information centre."
3326,1,Town history: The history of  and its response to Black Saturday is expressed in words throughout the picnic area and playground. Keep an eye out for murals and images as you explore.
3327,49,"Gallipoli Park: On 7 February 2009, a fire front destroyed nearly all the town's buildings. Some of the residents who survived the fire came to Gallipoli Park before being evacuated the next day. "
3328,32,"Into the : The path climbs as you leave , with views to your right and a gully of s ahead. Tourism took off here in 1886 when the railway linked  to the ,  inviting interest."
3329,4,"Look up: As you walk, keep your eyes high to see remnants from the bushfires and signs of new life, closer to the ground at your feet.  has a hidden valley feel, surrounded by mountains at all sides."
3330,46,"Like the lichen: As well as tree ferns and mountain ash, there's also plenty of moss and lichen to admire along this walk. The mostly dark cions suit the mossy blanket well."
3331,61,"Tiny mushrooms: Depending on the season, you might see a mushroom or two, clinging to a tree branch or nestled in the roots below."
3332,44,"Return to : At the end of the trail, you can visit Steavenson Falls and walk back to town the way you came. Enjoy the shade of the tall manna gums before the er tree ferns appear."
